id,observed_on,time_observed_at,quality_grade,latitude,longitude,geoprivacy,scientific_name,common_name,iconic_taxon_name,taxon_id,taxon_kingdom_name,taxon_phylum_name,taxon_class_name
120571,9/8/12,2012-09-08 18:17:20 UTC,research,36.0124044074,-78.8979879015,,Papilio polyxenes asterius,Eastern Black Swallowtail,Insecta,54900,Animalia,Arthropoda,Insecta
120579,9/8/12,2012-09-08 18:58:54 UTC,research,36.0123634848,-78.8979212634,,Papilio polyxenes,Black Swallowtail,Insecta,58523,Animalia,Arthropoda,Insecta
290192,5/5/13,2013-05-05 19:57:38 UTC,research,36.0134428133,-78.8922060827,,Harmonia axyridis,Asian Lady Beetle,Insecta,48484,Animalia,Arthropoda,Insecta
495597,8/7/13,,research,36.031451,-78.898702,,Agkistrodon contortrix,Eastern Copperhead,Reptilia,912622,Animalia,Chordata,Reptilia
528455,1/26/14,2014-01-26 20:04:45 UTC,research,36.023852,-78.925961,,Hedera helix,common ivy,Plantae,55882,Plantae,Tracheophyta,Magnoliopsida
611325,11/19/13,,research,36.007772,-78.919731,,Anaxyrus fowleri,Fowler's Toad,Amphibia,64977,Animalia,Chordata,Amphibia
653827,5/2/14,2014-05-02 18:49:56 UTC,research,36.0217458,-78.9440382,,Turdus migratorius,American Robin,Aves,12727,Animalia,Chordata,Aves
723433,5/31/14,2014-05-31 20:58:24 UTC,research,36.002078,-78.901659,,Phytolacca americana,American pokeweed,Plantae,48599,Plantae,Tracheophyta,Magnoliopsida
778055,7/1/14,2014-07-01 22:48:27 UTC,research,35.998106,-78.905289,,Fuligo septica,Dog Vomit Slime Mold,Protozoa,55483,Protozoa,Mycetozoa,Myxomycetes
856308,8/31/14,2014-08-31 23:15:32 UTC,research,36.01645507,-78.91547507,,Ceratomia catalpae,Catalpa Sphinx,Insecta,143440,Animalia,Arthropoda,Insecta
859803,8/30/14,2014-08-30 12:37:40 UTC,research,36.000648,-78.902669,,Melothria pendula,creeping cucumber,Plantae,131557,Plantae,Tracheophyta,Magnoliopsida
882643,7/6/14,2014-07-06 16:18:12 UTC,research,36.0043833333,-78.9017033333,,Peucetia viridans,Green Lynx Spider,Arachnida,126777,Animalia,Arthropoda,Arachnida
882647,8/8/14,2014-08-08 12:16:41 UTC,research,36.026975,-78.858375,,Anas platyrhynchos,Mallard,Aves,6930,Animalia,Chordata,Aves
893038,9/20/14,2014-09-20 12:16:09 UTC,research,36.0154,-78.9176416667,,Diospyros virginiana,American persimmon,Plantae,83435,Plantae,Tracheophyta,Magnoliopsida
900079,9/27/14,2014-09-27 19:21:08 UTC,research,35.999256,-78.910161,,Solenopsis invicta,Red Imported Fire Ant,Insecta,67598,Animalia,Arthropoda,Insecta
907806,10/3/14,2014-10-03 13:00:57 UTC,research,36.0299195,-78.8584133333,,Ipomoea purpurea,common morning-glory,Plantae,52344,Plantae,Tracheophyta,Magnoliopsida
1022174,10/15/14,2014-10-15 22:31:19 UTC,research,36.0032611167,-78.8941883333,,Buteo lineatus,Red-shouldered Hawk,Aves,5206,Animalia,Chordata,Aves
1169195,1/7/15,2015-01-07 16:47:59 UTC,research,36.003047,-78.901608,,Lamium amplexicaule,henbit deadnettle,Plantae,55459,Plantae,Tracheophyta,Magnoliopsida
1251169,2/22/15,2015-02-22 13:48:30 UTC,research,36.010934,-78.902843,,Scolopax minor,American Woodcock,Aves,3936,Animalia,Chordata,Aves
1287566,3/9/15,2015-03-09 16:34:00 UTC,research,36.001915,-78.90177,,Buteo lineatus,Red-shouldered Hawk,Aves,5206,Animalia,Chordata,Aves
1402731,4/17/15,2015-04-17 17:01:16 UTC,research,36.028009,-78.973576,,Arnica acaulis,Leopard's-bane,Plantae,82235,Plantae,Tracheophyta,Magnoliopsida
1428850,4/22/15,2015-04-22 23:38:58 UTC,research,36.003361,-78.894278,,Bignonia capreolata,cross vine,Plantae,67823,Plantae,Tracheophyta,Magnoliopsida
1584865,5/27/15,2015-05-27 14:26:32 UTC,research,36.0201945,-78.882745,,Storeria dekayi,Dekay's Brownsnake,Reptilia,28562,Animalia,Chordata,Reptilia
1610600,6/9/15,,research,36.006453,-78.859863,,Oxidus gracilis,Greenhouse Millipede,Animalia,143390,Animalia,Arthropoda,Diplopoda
1638280,6/16/15,2015-06-16 12:26:05 UTC,research,36.012387,-78.902997,,Graphocephala coccinea,Red-banded Leafhopper,Insecta,56925,Animalia,Arthropoda,Insecta
1733384,7/7/15,,research,36.013561,-78.903809,,Paulownia tomentosa,princess tree,Plantae,119792,Plantae,Tracheophyta,Magnoliopsida
1748824,7/11/15,2015-07-11 13:03:15 UTC,research,36.001796,-78.901525,,Helenium amarum,Bitterweed,Plantae,77348,Plantae,Tracheophyta,Magnoliopsida
1946996,9/14/15,2015-09-14 22:11:43 UTC,research,36.0019373,-78.9014423,,Cynodon dactylon,Bermuda grass,Plantae,58371,Plantae,Tracheophyta,Liliopsida
1946997,9/14/15,2015-09-14 22:14:15 UTC,research,36.0019291,-78.9014873,,Parthenocissus quinquefolia,Virginia creeper,Plantae,50278,Plantae,Tracheophyta,Magnoliopsida
1946998,9/14/15,2015-09-14 22:16:33 UTC,research,36.0019358,-78.9016123,,Phytolacca americana,American pokeweed,Plantae,48599,Plantae,Tracheophyta,Magnoliopsida
1946999,9/14/15,2015-09-14 22:19:27 UTC,research,36.0018421,-78.9014199,,Paulownia tomentosa,princess tree,Plantae,119792,Plantae,Tracheophyta,Magnoliopsida
1947000,9/14/15,2015-09-14 22:23:17 UTC,research,36.0018531,-78.9015446,,Sorghum halepense,Johnson grass,Plantae,58387,Plantae,Tracheophyta,Liliopsida
1949251,8/25/13,2013-08-25 16:36:41 UTC,research,36.013,-78.9235,,Nadata gibbosa,White-dotted Prominent,Insecta,82204,Animalia,Arthropoda,Insecta
1976647,9/23/15,2015-09-23 14:26:59 UTC,research,36.002101,-78.901825,,Scolia dubia,Blue-winged Scoliid Wasp,Insecta,1129479,Animalia,Arthropoda,Insecta
2086580,10/8/15,2015-10-08 14:18:06 UTC,research,36.00212909,-78.90176086,,Aedes albopictus,Asian Tiger Mosquito,Insecta,62984,Animalia,Arthropoda,Insecta
2348290,11/4/15,2015-11-04 17:55:01 UTC,research,36.00203752,-78.90170446,,Setophaga coronata,Yellow-rumped Warbler,Aves,145245,Animalia,Chordata,Aves
2586711,9/1/15,,research,36.008,-78.915,,Speyeria cybele,Great Spangled Fritillary,Insecta,47980,Animalia,Arthropoda,Insecta
2586780,11/7/15,,research,36.008,-78.915,,Sciurus carolinensis,Eastern Gray Squirrel,Mammalia,46017,Animalia,Chordata,Mammalia
2633947,1/31/16,2016-01-31 19:21:30 UTC,research,36.02360063,-78.92766693,,Asimina triloba,common pawpaw,Plantae,50897,Plantae,Tracheophyta,Magnoliopsida
2635031,1/24/16,2016-01-24 21:05:25 UTC,research,36.0085222167,-78.914995,,Sciurus carolinensis,Eastern Gray Squirrel,Mammalia,46017,Animalia,Chordata,Mammalia
2703913,8/29/15,,research,36.065385,-78.805593,,Charadrius vociferus,Killdeer,Aves,4793,Animalia,Chordata,Aves
2703915,8/29/15,,research,36.065385,-78.805593,,Tringa flavipes,Lesser Yellowlegs,Aves,3893,Animalia,Chordata,Aves
2703917,8/29/15,,research,36.065385,-78.805593,,Calidris melanotos,Pectoral Sandpiper,Aves,3865,Animalia,Chordata,Aves
2703919,8/29/15,,research,36.065385,-78.805593,,Calidris pusilla,Semipalmated Sandpiper,Aves,3862,Animalia,Chordata,Aves
2740434,3/3/16,2016-03-03 15:58:32 UTC,research,36.0046901275,-78.9015333262,,Alsophila pometaria,Fall Cankerworm Moth,Insecta,215208,Animalia,Arthropoda,Insecta
2745418,5/24/12,2012-05-25 02:00:12 UTC,research,36.012062,-78.8979,,Thryothorus ludovicianus,Carolina Wren,Aves,7513,Animalia,Chordata,Aves
2745441,8/10/13,2013-08-11 03:03:29 UTC,research,36.012062,-78.8979,,Papilio polyxenes asterius,Eastern Black Swallowtail,Insecta,54900,Animalia,Arthropoda,Insecta
2745446,8/10/13,2013-08-11 03:03:29 UTC,research,36.012062,-78.8979,,Papilio polyxenes asterius,Eastern Black Swallowtail,Insecta,54900,Animalia,Arthropoda,Insecta
2745488,3/18/12,2012-03-18 16:07:04 UTC,research,36.012062,-78.8979,,Haldea striatula,Rough Earthsnake,Reptilia,539765,Animalia,Chordata,Reptilia
2939712,4/15/16,2016-04-15 15:17:34 UTC,research,36.0087179672,-78.9233628196,,Viola sororia,common blue violet,Plantae,82816,Plantae,Tracheophyta,Magnoliopsida
2958261,4/14/16,2016-04-14 20:31:58 UTC,research,36.0087583333,-78.9194033333,,Cupido comyntas,Eastern Tailed-Blue,Insecta,122381,Animalia,Arthropoda,Insecta
2977881,4/19/16,2016-04-19 23:45:02 UTC,research,36.0151331,-78.91849278,,Cardinalis cardinalis,Northern Cardinal,Aves,9083,Animalia,Chordata,Aves
3019705,4/24/16,2016-04-24 11:11:17 UTC,research,36.008893,-78.9152544,,Sylvilagus floridanus,Eastern Cottontail,Mammalia,43111,Animalia,Chordata,Mammalia
3019710,4/24/16,2016-04-24 11:13:52 UTC,research,36.00867694,-78.91566278,,Trifolium repens,white clover,Plantae,55745,Plantae,Tracheophyta,Magnoliopsida
3019749,4/24/16,2016-04-24 11:29:31 UTC,research,36.0087481,-78.9141493,,Rhododendron mucronatum,White Azalea,Plantae,431273,Plantae,Tracheophyta,Magnoliopsida
3019819,4/24/16,2016-04-24 11:54:01 UTC,research,36.0072788599,-78.9150215685,,Sciurus carolinensis,Eastern Gray Squirrel,Mammalia,46017,Animalia,Chordata,Mammalia
3022110,4/19/16,2016-04-19 23:42:16 UTC,research,36.0135662277,-78.92326165,,Poecile carolinensis,Carolina Chickadee,Aves,144814,Animalia,Chordata,Aves
3452070,6/13/16,2016-06-13 21:56:09 UTC,research,36.0224012565,-78.8971626666,,Liquidambar styraciflua,American sweetgum,Plantae,49658,Plantae,Tracheophyta,Magnoliopsida
3452121,6/13/16,2016-06-13 22:02:00 UTC,research,36.0205418151,-78.8967863192,,Cercis canadensis,eastern redbud,Plantae,48502,Plantae,Tracheophyta,Magnoliopsida
3453361,6/8/16,2016-06-08 21:59:00 UTC,research,36.0055333333,-78.9082444444,,Quercus phellos,willow oak,Plantae,119983,Plantae,Tracheophyta,Magnoliopsida
3492758,6/20/16,2016-06-20 23:56:20 UTC,research,36.025947514,-78.89701196,,Phytolacca americana,American pokeweed,Plantae,48599,Plantae,Tracheophyta,Magnoliopsida
3492994,6/20/16,2016-06-21 00:21:56 UTC,research,36.0220605322,-78.8974137884,,Verbesina occidentalis,Yellow Crownbeard,Plantae,136384,Plantae,Tracheophyta,Magnoliopsida
3493055,6/20/16,2016-06-21 00:33:10 UTC,research,36.0191599327,-78.8952374273,,Alaus oculatus,Eastern Eyed Click Beetle,Insecta,81706,Animalia,Arthropoda,Insecta
3493072,6/20/16,2016-06-21 00:34:47 UTC,research,36.0197443189,-78.8942981512,,Lunaria annua,Annual Honesty,Plantae,55886,Plantae,Tracheophyta,Magnoliopsida
3493091,6/20/16,2016-06-21 00:39:27 UTC,research,36.0200017272,-78.8926795219,,Ambrosia artemisiifolia,common ragweed,Plantae,53587,Plantae,Tracheophyta,Magnoliopsida
3511131,6/23/16,2016-06-23 23:21:20 UTC,research,36.0257658782,-78.8957280201,,Liquidambar styraciflua,American sweetgum,Plantae,49658,Plantae,Tracheophyta,Magnoliopsida
3521832,6/25/16,2016-06-25 23:20:19 UTC,research,36.0203332734,-78.8958789781,,Saururus cernuus,lizard's tail,Plantae,60742,Plantae,Tracheophyta,Magnoliopsida
3521866,6/25/16,2016-06-25 23:25:54 UTC,research,36.0220600712,-78.8958161139,,Glechoma hederacea,ground-ivy,Plantae,55830,Plantae,Tracheophyta,Magnoliopsida
3528332,6/26/16,2016-06-26 15:50:21 UTC,research,36.0843956145,-78.8226047159,,Smilax rotundifolia,roundleaf greenbrier,Plantae,60746,Plantae,Tracheophyta,Liliopsida
3528353,6/26/16,2016-06-26 15:55:24 UTC,research,36.0843648948,-78.8221791667,,Acer rubrum,red maple,Plantae,48098,Plantae,Tracheophyta,Magnoliopsida
3528442,6/26/16,2016-06-26 16:09:55 UTC,research,36.0847001709,-78.8216378634,,Ilex opaca,American holly,Plantae,60749,Plantae,Tracheophyta,Magnoliopsida
3528452,6/26/16,2016-06-26 16:10:42 UTC,research,36.0847337405,-78.8213917707,,Liquidambar styraciflua,American sweetgum,Plantae,49658,Plantae,Tracheophyta,Magnoliopsida
3528463,6/26/16,2016-06-26 16:11:46 UTC,research,36.0845553317,-78.8213618473,,Liriodendron tulipifera,tulip tree,Plantae,53582,Plantae,Tracheophyta,Magnoliopsida
3528486,6/26/16,2016-06-26 16:15:00 UTC,research,36.0847548209,-78.8207498845,,Quercus marilandica,blackjack oak,Plantae,82329,Plantae,Tracheophyta,Magnoliopsida
3528492,6/26/16,2016-06-26 16:15:51 UTC,research,36.0847042781,-78.8208181971,,Acer negundo,boxelder,Plantae,47726,Plantae,Tracheophyta,Magnoliopsida
3528506,6/26/16,2016-06-26 16:17:39 UTC,research,36.0847799247,-78.8206322026,,Campsis radicans,American trumpet vine,Plantae,75995,Plantae,Tracheophyta,Magnoliopsida
3528553,6/26/16,2016-06-26 16:23:26 UTC,research,36.0847824393,-78.8204367366,,Saururus cernuus,lizard's tail,Plantae,60742,Plantae,Tracheophyta,Magnoliopsida
3528568,6/26/16,2016-06-26 16:26:41 UTC,research,36.0847523902,-78.8203822543,,Ligustrum sinense,Chinese privet,Plantae,128769,Plantae,Tracheophyta,Magnoliopsida
3528589,6/26/16,2016-06-26 16:32:38 UTC,research,36.0846021865,-78.8197301422,,Bignonia capreolata,cross vine,Plantae,67823,Plantae,Tracheophyta,Magnoliopsida
3528591,6/26/16,2016-06-26 17:27:29 UTC,research,36.0760319,-78.8102238067,,Asimina triloba,common pawpaw,Plantae,50897,Plantae,Tracheophyta,Magnoliopsida
3535033,6/27/16,2016-06-27 21:44:27 UTC,research,36.0223149229,-78.8961868455,,Cephalanthus occidentalis,buttonbush,Plantae,52763,Plantae,Tracheophyta,Magnoliopsida
3535047,6/27/16,2016-06-27 21:50:57 UTC,research,36.0213496629,-78.8954926562,,Impatiens capensis,common jewelweed,Plantae,47888,Plantae,Tracheophyta,Magnoliopsida
3535117,6/27/16,2016-06-27 22:02:55 UTC,research,36.0213425383,-78.8967117202,,Microstegium vimineum,Japanese stiltgrass,Plantae,116710,Plantae,Tracheophyta,Liliopsida
3541193,6/28/16,2016-06-28 22:06:45 UTC,research,36.0064604273,-78.9029271529,,Nandina domestica,Heavenly bamboo,Plantae,127010,Plantae,Tracheophyta,Magnoliopsida
3541197,6/28/16,2016-06-28 22:08:58 UTC,research,36.0066193482,-78.9028930385,,Elaeagnus umbellata,autumn olive,Plantae,64697,Plantae,Tracheophyta,Magnoliopsida
3541203,6/28/16,2016-06-28 22:11:17 UTC,research,36.0075551458,-78.9031803702,,Sorghum halepense,Johnson grass,Plantae,58387,Plantae,Tracheophyta,Liliopsida
3541277,6/28/16,2016-06-28 22:19:00 UTC,research,36.0088580707,-78.903362006,,Diodia virginiana,buttonweed,Plantae,131003,Plantae,Tracheophyta,Magnoliopsida
3541284,6/28/16,2016-06-28 22:21:00 UTC,research,36.0097610532,-78.903066963,,Ligustrum sinense,Chinese privet,Plantae,128769,Plantae,Tracheophyta,Magnoliopsida
3541288,6/28/16,2016-06-28 22:23:12 UTC,research,36.0108742956,-78.9026275837,,Impatiens capensis,common jewelweed,Plantae,47888,Plantae,Tracheophyta,Magnoliopsida
3541297,6/28/16,2016-06-28 22:25:13 UTC,research,36.0113407066,-78.9023485501,,Acer negundo,boxelder,Plantae,47726,Plantae,Tracheophyta,Magnoliopsida
3541303,6/28/16,2016-06-28 22:26:12 UTC,research,36.0114958138,-78.9023771324,,Microstegium vimineum,Japanese stiltgrass,Plantae,116710,Plantae,Tracheophyta,Liliopsida
3541351,6/28/16,2016-06-28 22:33:33 UTC,research,36.0129597131,-78.9019338135,,Solanum carolinense,Carolina horsenettle,Plantae,52899,Plantae,Tracheophyta,Magnoliopsida
3541356,6/28/16,2016-06-28 22:34:59 UTC,research,36.0134702968,-78.9017701988,,Toxicodendron radicans,poison ivy,Plantae,58732,Plantae,Tracheophyta,Magnoliopsida
3541370,6/28/16,2016-06-28 22:41:03 UTC,research,36.0149608925,-78.9008913562,,Hedera helix,common ivy,Plantae,55882,Plantae,Tracheophyta,Magnoliopsida
3541376,6/28/16,2016-06-28 22:42:33 UTC,research,36.0157084326,-78.9003881906,,Morus alba,white mulberry,Plantae,56090,Plantae,Tracheophyta,Magnoliopsida
3541378,6/28/16,2016-06-28 22:43:34 UTC,research,36.0159568303,-78.9000800718,,Liriodendron tulipifera,tulip tree,Plantae,53582,Plantae,Tracheophyta,Magnoliopsida
3541382,6/28/16,2016-06-28 22:45:00 UTC,research,36.0167421727,-78.900030451,,Liquidambar styraciflua,American sweetgum,Plantae,49658,Plantae,Tracheophyta,Magnoliopsida
3541394,6/28/16,2016-06-28 22:45:45 UTC,research,36.0171123175,-78.9001084865,,Wisteria sinensis,Chinese wisteria,Plantae,127306,Plantae,Tracheophyta,Magnoliopsida
3541620,6/28/16,2016-06-29 00:43:06 UTC,research,36.0286722612,-78.8982803096,,Prunella vulgaris,common selfheal,Plantae,52764,Plantae,Tracheophyta,Magnoliopsida
3541700,6/28/16,2016-06-29 00:45:11 UTC,research,36.0288619437,-78.8998069056,,Acer rubrum,red maple,Plantae,48098,Plantae,Tracheophyta,Magnoliopsida
3541759,6/28/16,2016-06-29 00:58:19 UTC,research,36.0259909323,-78.900795132,,Asclepias syriaca,common milkweed,Plantae,47911,Plantae,Tracheophyta,Magnoliopsida
3634569,7/6/16,2016-07-06 22:43:18 UTC,research,36.0298647546,-78.8949868084,,Elaeagnus umbellata,autumn olive,Plantae,64697,Plantae,Tracheophyta,Magnoliopsida
3634580,7/6/16,2016-07-06 22:46:20 UTC,research,36.0296601523,-78.8959255815,,Microstegium vimineum,Japanese stiltgrass,Plantae,116710,Plantae,Tracheophyta,Liliopsida
3658010,7/10/16,2016-07-10 23:00:38 UTC,research,36.06045736,-78.8167539798,,Microstegium vimineum,Japanese stiltgrass,Plantae,116710,Plantae,Tracheophyta,Liliopsida
3658019,7/10/16,2016-07-10 23:05:07 UTC,research,36.0605216911,-78.8150899206,,Sassafras albidum,sassafras,Plantae,54795,Plantae,Tracheophyta,Magnoliopsida
3658024,7/10/16,2016-07-10 23:07:53 UTC,research,36.0609382717,-78.8145447616,,Passiflora lutea,yellow passionflower,Plantae,51450,Plantae,Tracheophyta,Magnoliopsida
3658046,7/10/16,2016-07-10 23:08:39 UTC,research,36.060820967,-78.8141168655,,Impatiens capensis,common jewelweed,Plantae,47888,Plantae,Tracheophyta,Magnoliopsida
3658055,7/10/16,2016-07-10 23:11:13 UTC,research,36.0610247311,-78.813153701,,Parthenocissus quinquefolia,Virginia creeper,Plantae,50278,Plantae,Tracheophyta,Magnoliopsida
3658060,7/10/16,2016-07-10 23:17:57 UTC,research,36.0613594205,-78.8107407187,,Parthenium integrifolium,wild quinine,Plantae,83893,Plantae,Tracheophyta,Magnoliopsida
3658064,7/10/16,2016-07-10 23:19:06 UTC,research,36.0615476361,-78.8108793554,,Cercis canadensis,eastern redbud,Plantae,48502,Plantae,Tracheophyta,Magnoliopsida
3658069,7/10/16,2016-07-10 23:20:14 UTC,research,36.0616164934,-78.8109287248,,Cornus florida,flowering dogwood,Plantae,54777,Plantae,Tracheophyta,Magnoliopsida
3658075,7/10/16,2016-07-10 23:21:34 UTC,research,36.0618288908,-78.8110975363,,Hexastylis arifolia,little brown jug,Plantae,122183,Plantae,Tracheophyta,Magnoliopsida
3658082,7/10/16,2016-07-10 23:23:49 UTC,research,36.0623479821,-78.8110317384,,Daucus carota,wild carrot,Plantae,76610,Plantae,Tracheophyta,Magnoliopsida
3658085,7/10/16,2016-07-10 23:24:43 UTC,research,36.0623664642,-78.8110180759,,Xylocopa virginica,Eastern Carpenter Bee,Insecta,51110,Animalia,Arthropoda,Insecta
3658089,7/10/16,2016-07-10 23:25:42 UTC,research,36.0623664642,-78.8110180759,,Prunella vulgaris,common selfheal,Plantae,52764,Plantae,Tracheophyta,Magnoliopsida
3658103,7/10/16,2016-07-10 23:27:02 UTC,research,36.0624535103,-78.8109978755,,Papilio glaucus,Eastern Tiger Swallowtail,Insecta,60551,Animalia,Arthropoda,Insecta
3658118,7/10/16,2016-07-10 23:28:25 UTC,research,36.0625071964,-78.8110210095,,Pandion haliaetus,Osprey,Aves,116999,Animalia,Chordata,Aves
3658121,7/10/16,2016-07-10 23:29:11 UTC,research,36.0626678774,-78.8110245299,,Sabatia angularis,Rosepink,Plantae,84666,Plantae,Tracheophyta,Magnoliopsida
3658125,7/10/16,2016-07-10 23:30:08 UTC,research,36.0628961586,-78.8107864839,,Lespedeza cuneata,Chinese bushclover,Plantae,164566,Plantae,Tracheophyta,Magnoliopsida
3658138,7/10/16,2016-07-10 23:31:55 UTC,research,36.062927465,-78.810630329,,Ambrosia artemisiifolia,common ragweed,Plantae,53587,Plantae,Tracheophyta,Magnoliopsida
3658142,7/10/16,2016-07-10 23:32:38 UTC,research,36.0630276287,-78.8105284051,,Phytolacca americana,American pokeweed,Plantae,48599,Plantae,Tracheophyta,Magnoliopsida
3658148,7/10/16,2016-07-10 23:35:07 UTC,research,36.0634540161,-78.8102527243,,Liriodendron tulipifera,tulip tree,Plantae,53582,Plantae,Tracheophyta,Magnoliopsida
3658150,7/10/16,2016-07-10 23:35:36 UTC,research,36.0634540161,-78.8102527243,,Toxicodendron radicans,poison ivy,Plantae,58732,Plantae,Tracheophyta,Magnoliopsida
3658169,7/10/16,2016-07-10 23:37:37 UTC,research,36.0640174896,-78.8103034348,,Ligustrum sinense,Chinese privet,Plantae,128769,Plantae,Tracheophyta,Magnoliopsida
3658191,7/10/16,2016-07-10 23:40:07 UTC,research,36.0646603396,-78.8103155886,,Smilax rotundifolia,roundleaf greenbrier,Plantae,60746,Plantae,Tracheophyta,Liliopsida
3658201,7/10/16,2016-07-10 23:44:50 UTC,research,36.0614504479,-78.810730409,,Libellula cyanea,Spangled Skimmer,Insecta,104575,Animalia,Arthropoda,Insecta
3658231,7/10/16,2016-07-10 23:55:26 UTC,research,36.0604057694,-78.8166245633,,Elaeagnus umbellata,autumn olive,Plantae,64697,Plantae,Tracheophyta,Magnoliopsida
3665926,7/12/16,2016-07-12 16:15:56 UTC,research,36.0019888496,-78.9018807561,,Xenox tigrinus,Tiger Bee Fly,Insecta,133799,Animalia,Arthropoda,Insecta
3821337,8/3/16,2016-08-03 11:41:57 UTC,research,36.0053888833,-78.8995283333,,Laetiporus sulphureus,chicken of the woods,Fungi,53713,Fungi,Basidiomycota,Agaricomycetes
3835542,8/8/16,2016-08-08 13:41:52 UTC,research,36.01815,-78.8888333333,,Pachydiplax longipennis,Blue Dasher,Insecta,59774,Animalia,Arthropoda,Insecta
4008458,8/31/16,2016-08-31 19:19:00 UTC,research,36.002276,-78.90179,,Sphecius speciosus,Eastern Cicada-killer Wasp,Insecta,51954,Animalia,Arthropoda,Insecta
4189166,9/24/16,2016-09-24 13:28:29 UTC,research,36.0730482778,-78.7988719438,,Microstegium vimineum,Japanese stiltgrass,Plantae,116710,Plantae,Tracheophyta,Liliopsida
4189191,9/24/16,2016-09-24 13:29:45 UTC,research,36.0731147882,-78.7989477162,,Lonicera japonica,Japanese honeysuckle,Plantae,77835,Plantae,Tracheophyta,Magnoliopsida
4189386,9/24/16,2016-09-24 13:36:59 UTC,research,36.0730229644,-78.7987359893,,Rosa multiflora,multiflora rose,Plantae,78882,Plantae,Tracheophyta,Magnoliopsida
4190514,9/24/16,2016-09-24 15:27:33 UTC,research,36.0763252247,-78.8140567672,,Helenium amarum,Bitterweed,Plantae,77348,Plantae,Tracheophyta,Magnoliopsida
4190542,9/24/16,2016-09-24 15:28:44 UTC,research,36.0762578342,-78.8140409254,,Campsis radicans,American trumpet vine,Plantae,75995,Plantae,Tracheophyta,Magnoliopsida
4190600,9/24/16,2016-09-24 15:31:16 UTC,research,36.0762708262,-78.8141130098,,Junonia coenia,Common Buckeye,Insecta,48505,Animalia,Arthropoda,Insecta
4194111,9/24/16,2016-09-24 20:36:02 UTC,research,36.0095111167,-78.9197616667,,Urbanus proteus,Long-tailed Skipper,Insecta,67435,Animalia,Arthropoda,Insecta
4194463,9/24/16,2016-09-24 15:37:18 UTC,research,36.0756813269,-78.8141091541,,Eupatorium capillifolium,dogfennel,Plantae,131154,Plantae,Tracheophyta,Magnoliopsida
4208086,9/26/16,2016-09-26 18:30:26 UTC,research,36.0020411527,-78.9005920385,,Ipomoea lacunosa,White Morning-glory,Plantae,135262,Plantae,Tracheophyta,Magnoliopsida
4248793,10/1/16,2016-10-01 21:42:29 UTC,research,36.0841785651,-78.8187347074,,Odontotaenius disjunctus,Horned Passalus Beetle,Insecta,122214,Animalia,Arthropoda,Insecta
4248806,10/1/16,2016-10-01 21:50:46 UTC,research,36.0807195213,-78.8183533308,,Euonymus americanus,strawberry bush,Plantae,83150,Plantae,Tracheophyta,Magnoliopsida
4249865,10/1/16,2016-10-02 02:42:31 UTC,research,36.0076354863,-78.9143895731,,Vireo olivaceus,Red-eyed Vireo,Aves,891704,Animalia,Chordata,Aves
4517435,11/8/16,2016-11-08 14:41:22 UTC,research,36.0072212219,-78.9155578613,,Thryothorus ludovicianus,Carolina Wren,Aves,7513,Animalia,Chordata,Aves
4575813,11/8/16,2016-11-08 20:47:08 UTC,research,36.0039,-78.9011383333,,Papilio polyxenes,Black Swallowtail,Insecta,58523,Animalia,Arthropoda,Insecta
4601610,10/27/16,2016-10-27 17:14:10 UTC,research,36.0067134328,-78.8533506158,,Euonymus americanus,strawberry bush,Plantae,83150,Plantae,Tracheophyta,Magnoliopsida
4791123,12/18/16,2016-12-18 18:40:02 UTC,research,36.0302528333,-78.9149366667,,Anolis carolinensis,Green Anole,Reptilia,36514,Animalia,Chordata,Reptilia
5003686,1/24/17,2017-01-25 03:14:00 UTC,research,36.0056739965,-78.8527453336,,Haldea striatula,Rough Earthsnake,Reptilia,539765,Animalia,Chordata,Reptilia
5069415,2/7/17,2017-02-07 19:21:32 UTC,research,36.0044798655,-78.9012280103,,Foeniculum vulgare,fennel,Plantae,53052,Plantae,Tracheophyta,Magnoliopsida
5096281,2/12/17,2017-02-12 16:33:09 UTC,research,36.0604957072,-78.8153581415,,Asplenium platyneuron,ebony spleenwort,Plantae,122056,Plantae,Tracheophyta,Polypodiopsida
5102470,2/13/17,2017-02-13 16:10:36 UTC,research,36.0042433595,-78.9010787066,,Taraxacum officinale,common dandelion,Plantae,47602,Plantae,Tracheophyta,Magnoliopsida
5129227,2/12/17,2017-02-12 17:25:15 UTC,research,36.0708831484,-78.8012963255,,Acris crepitans,Northern Cricket Frog,Amphibia,24230,Animalia,Chordata,Amphibia
5136656,2/19/17,2017-02-19 20:29:20 UTC,research,36.080526989,-78.8152754959,,Tipularia discolor,crane-fly orchid,Plantae,121490,Plantae,Tracheophyta,Liliopsida
5136681,2/19/17,2017-02-19 20:30:39 UTC,research,36.0804888932,-78.8151628432,,Tipularia discolor,crane-fly orchid,Plantae,121490,Plantae,Tracheophyta,Liliopsida
5137080,2/19/17,2017-02-19 20:32:18 UTC,research,36.080584866,-78.8150060178,,Trachemys scripta,Common Slider,Reptilia,39782,Animalia,Chordata,Reptilia
5137102,2/19/17,2017-02-19 20:33:38 UTC,research,36.0807107622,-78.8149773516,,Betula nigra,river birch,Plantae,117429,Plantae,Tracheophyta,Magnoliopsida
5137120,2/19/17,2017-02-19 20:33:53 UTC,research,36.0805211217,-78.8146763575,,Castor canadensis,American Beaver,Mammalia,43794,Animalia,Chordata,Mammalia
5137136,2/19/17,2017-02-19 20:40:49 UTC,research,36.0805695271,-78.8147269004,,Acer rubrum,red maple,Plantae,48098,Plantae,Tracheophyta,Magnoliopsida
5137147,2/19/17,2017-02-19 20:44:45 UTC,research,36.0804156354,-78.814847516,,Allium vineale,wild garlic,Plantae,75371,Plantae,Tracheophyta,Liliopsida
5148337,2/21/17,2017-02-21 17:09:06 UTC,research,36.0160587123,-78.9326411673,,Cardinalis cardinalis,Northern Cardinal,Aves,9083,Animalia,Chordata,Aves
5148561,2/21/17,2017-02-21 17:32:39 UTC,research,36.026299093,-78.8970710524,,Turdus migratorius,American Robin,Aves,12727,Animalia,Chordata,Aves
5148583,2/21/17,2017-02-21 17:38:59 UTC,research,36.0260330933,-78.8971582242,,Pipilo erythrophthalmus,Eastern Towhee,Aves,9424,Animalia,Chordata,Aves
5149515,2/21/17,2017-02-21 20:45:36 UTC,research,36.0258681793,-78.8970083558,,Hedera helix,common ivy,Plantae,55882,Plantae,Tracheophyta,Magnoliopsida
5185699,2/26/17,2017-02-26 19:27:30 UTC,research,36.0138320923,-78.8943862915,,Claytonia virginica,Virginia spring beauty,Plantae,117434,Plantae,Tracheophyta,Magnoliopsida
5185707,2/26/17,2017-02-26 19:27:02 UTC,research,36.0136642456,-78.8943862915,,Viola sororia,common blue violet,Plantae,82816,Plantae,Tracheophyta,Magnoliopsida
5185711,2/26/17,2017-02-26 19:26:53 UTC,research,36.0136642456,-78.8943862915,,Claytonia virginica,Virginia spring beauty,Plantae,117434,Plantae,Tracheophyta,Magnoliopsida
5241535,3/6/17,2017-03-07 04:30:05 UTC,research,36.0262982548,-78.8970102836,,Ectropis crepuscularia,Small Engrailed,Insecta,143009,Animalia,Arthropoda,Insecta
5307008,3/14/17,2017-03-14 19:20:15 UTC,research,36.0108070374,-78.9195861816,,Vicia sativa,Common Vetch,Plantae,53324,Plantae,Tracheophyta,Magnoliopsida
5307015,3/14/17,2017-03-14 19:21:18 UTC,research,36.0109024048,-78.9194030762,,Verbascum thapsus,great mullein,Plantae,59029,Plantae,Tracheophyta,Magnoliopsida
5307022,3/14/17,2017-03-14 19:19:52 UTC,research,36.0100898743,-78.9186553955,,Vinca major,greater periwinkle,Plantae,53326,Plantae,Tracheophyta,Magnoliopsida
5382410,3/17/17,2017-03-17 20:12:52 UTC,research,36.0261441116,-78.8971762453,,Thryothorus ludovicianus,Carolina Wren,Aves,7513,Animalia,Chordata,Aves
5382419,3/17/17,2017-03-17 20:13:50 UTC,research,36.026282874,-78.8972293027,,Cardinalis cardinalis,Northern Cardinal,Aves,9083,Animalia,Chordata,Aves
5382427,3/17/17,2017-03-17 15:46:03 UTC,research,36.0326839115,-78.9769304798,,Hepatica americana,round-lobed hepatica,Plantae,741014,Plantae,Tracheophyta,Magnoliopsida
5388985,3/17/17,2017-03-17 17:48:15 UTC,research,36.0234083333,-78.92862,,Ardea herodias,Great Blue Heron,Aves,4956,Animalia,Chordata,Aves
5409465,3/20/17,2017-03-20 16:37:21 UTC,research,36.0240583333,-78.9248416667,,Toxomerus geminatus,Eastern Calligrapher,Insecta,126532,Animalia,Arthropoda,Insecta
5417428,3/21/17,2017-03-21 15:56:14 UTC,research,36.0138607,-78.921708,,Trifolium repens,white clover,Plantae,55745,Plantae,Tracheophyta,Magnoliopsida
5443341,3/24/17,2017-03-24 16:48:55 UTC,research,36.0231028333,-78.928895,,Bombycilla cedrorum,Cedar Waxwing,Aves,7428,Animalia,Chordata,Aves
5445411,3/24/17,2017-03-24 21:07:57 UTC,research,36.0136108398,-78.919303894,,Punctelia rudecta,rough speckled shield lichen,Fungi,151767,Fungi,Ascomycota,Lecanoromycetes
5445418,3/24/17,2017-03-24 21:10:43 UTC,research,36.0159566,-78.9189675,,Hedera helix,common ivy,Plantae,55882,Plantae,Tracheophyta,Magnoliopsida
5445494,3/24/17,2017-03-24 21:11:04 UTC,research,36.0158652835,-78.9190796535,,Trifolium repens,white clover,Plantae,55745,Plantae,Tracheophyta,Magnoliopsida
5447031,3/24/17,2017-03-24 21:38:03 UTC,research,36.013004303,-78.9170227051,,Veronica hederifolia,Ivy-leaved Speedwell,Plantae,56129,Plantae,Tracheophyta,Magnoliopsida
5447033,3/24/17,2017-03-24 21:30:55 UTC,research,36.0149726868,-78.9169006348,,Viola sororia priceana,Confederate violet,Plantae,348951,Plantae,Tracheophyta,Magnoliopsida
5447036,3/24/17,2017-03-24 21:30:44 UTC,research,36.0149459839,-78.9168701172,,Viola sororia priceana,Confederate violet,Plantae,348951,Plantae,Tracheophyta,Magnoliopsida
5447064,3/24/17,2017-03-24 21:25:32 UTC,research,36.0159225464,-78.9180984497,,Lamium purpureum,red deadnettle,Plantae,55851,Plantae,Tracheophyta,Magnoliopsida
5447076,3/24/17,2017-03-24 21:24:56 UTC,research,36.016040802,-78.9181213379,,Galium aparine,catchweed bedstraw,Plantae,53059,Plantae,Tracheophyta,Magnoliopsida
5447078,3/24/17,2017-03-24 21:24:49 UTC,research,36.0160293579,-78.9181137085,,Muscari neglectum,Grape hyacinth,Plantae,68846,Plantae,Tracheophyta,Liliopsida
5447093,3/24/17,2017-03-24 21:24:26 UTC,research,36.0161094666,-78.9179077148,,Ipheion uniflorum,Spring starflower,Plantae,77493,Plantae,Tracheophyta,Liliopsida
5447123,3/24/17,2017-03-24 21:22:03 UTC,research,36.0164451599,-78.9179077148,,Glechoma hederacea,ground-ivy,Plantae,55830,Plantae,Tracheophyta,Magnoliopsida
5447130,3/24/17,2017-03-24 21:20:16 UTC,research,36.01720047,-78.9187927246,,Sherardia arvensis,Field madder,Plantae,47691,Plantae,Tracheophyta,Magnoliopsida
5449473,3/24/17,2017-03-24 22:09:39 UTC,research,36.0151100159,-78.9179916382,,Ranunculus abortivus,small-flowered buttercup,Plantae,126371,Plantae,Tracheophyta,Magnoliopsida
5472003,3/26/17,2017-03-26 21:44:00 UTC,research,36.0057138889,-78.8531805556,,Viola bicolor,American field pansy,Plantae,57631,Plantae,Tracheophyta,Magnoliopsida
5488968,3/28/17,2017-03-28 16:11:29 UTC,research,36.0242319061,-78.8960959856,,Aquilegia canadensis,red columbine,Plantae,49868,Plantae,Tracheophyta,Magnoliopsida
5489019,3/28/17,2017-03-28 16:12:57 UTC,research,36.0240512342,-78.8967333455,,Cercis canadensis,eastern redbud,Plantae,48502,Plantae,Tracheophyta,Magnoliopsida
5489112,3/28/17,2017-03-28 16:19:32 UTC,research,36.0221983306,-78.897453351,,Trifolium repens,white clover,Plantae,55745,Plantae,Tracheophyta,Magnoliopsida
5489132,3/28/17,2017-03-28 16:21:16 UTC,research,36.0218756693,-78.8974425384,,Taraxacum officinale,common dandelion,Plantae,47602,Plantae,Tracheophyta,Magnoliopsida
5489142,3/28/17,2017-03-28 16:23:09 UTC,research,36.0212062067,-78.8972624951,,Hedera helix,common ivy,Plantae,55882,Plantae,Tracheophyta,Magnoliopsida
5489177,3/28/17,2017-03-28 16:24:24 UTC,research,36.0206136899,-78.8968738262,,Cornus florida,flowering dogwood,Plantae,54777,Plantae,Tracheophyta,Magnoliopsida
5489190,3/28/17,2017-03-28 16:24:47 UTC,research,36.0204939125,-78.8967809547,,Vinca major,greater periwinkle,Plantae,53326,Plantae,Tracheophyta,Magnoliopsida
5489969,3/28/17,2017-03-28 16:47:14 UTC,research,36.023475,-78.927995,,Cornus florida,flowering dogwood,Plantae,54777,Plantae,Tracheophyta,Magnoliopsida
5489975,3/28/17,2017-03-28 16:48:34 UTC,research,36.0234971667,-78.92758,,Rhododendron canescens,Mountain Azalea,Plantae,56232,Plantae,Tracheophyta,Magnoliopsida
5489983,3/28/17,2017-03-28 17:00:49 UTC,research,36.0252805,-78.92292,,Anas platyrhynchos,Mallard,Aves,6930,Animalia,Chordata,Aves
5500519,3/29/17,2017-03-29 18:11:23 UTC,research,36.0243945,-78.9253833333,,Potentilla indica,mock strawberry,Plantae,243824,Plantae,Tracheophyta,Magnoliopsida
5500525,3/29/17,2017-03-29 18:12:24 UTC,research,36.0243305,-78.9255666667,,Anas platyrhynchos,Mallard,Aves,6930,Animalia,Chordata,Aves
5508093,3/28/17,2017-03-28 16:25:11 UTC,research,36.0203569522,-78.896719683,,Lonicera japonica,Japanese honeysuckle,Plantae,77835,Plantae,Tracheophyta,Magnoliopsida
5508255,3/28/17,2017-03-28 16:25:57 UTC,research,36.0201210017,-78.8965750114,,Elaeagnus umbellata,autumn olive,Plantae,64697,Plantae,Tracheophyta,Magnoliopsida
5508264,3/28/17,2017-03-28 16:27:02 UTC,research,36.0198243661,-78.8964191918,,Cercis canadensis,eastern redbud,Plantae,48502,Plantae,Tracheophyta,Magnoliopsida
5508297,3/28/17,2017-03-28 16:32:57 UTC,research,36.019828138,-78.8942160924,,Aquilegia canadensis,red columbine,Plantae,49868,Plantae,Tracheophyta,Magnoliopsida
5508306,3/28/17,2017-03-28 16:38:52 UTC,research,36.0198341729,-78.8914914709,,Lamium purpureum,red deadnettle,Plantae,55851,Plantae,Tracheophyta,Magnoliopsida
5508313,3/28/17,2017-03-28 16:40:58 UTC,research,36.0196127904,-78.8912605365,,Prunus serotina,black cherry,Plantae,54834,Plantae,Tracheophyta,Magnoliopsida
5508317,3/28/17,2017-03-28 16:42:10 UTC,research,36.0202503344,-78.8912989386,,Campsis radicans,American trumpet vine,Plantae,75995,Plantae,Tracheophyta,Magnoliopsida
5518938,3/31/17,2017-03-31 16:47:15 UTC,research,36.0237416667,-78.92598,,Xylocopa virginica,Eastern Carpenter Bee,Insecta,51110,Animalia,Arthropoda,Insecta
5518943,3/31/17,2017-03-31 17:00:36 UTC,research,36.0242888333,-78.925675,,Ellychnia corrusca,Winter Firefly,Insecta,125627,Animalia,Arthropoda,Insecta
5570872,4/2/17,2017-04-02 19:50:00 UTC,research,36.0219880706,-78.8912243397,,Sciurus carolinensis,Eastern Gray Squirrel,Mammalia,46017,Animalia,Chordata,Mammalia
5570969,4/4/17,2017-04-04 20:32:43 UTC,research,36.0261739511,-78.8970521931,,Agkistrodon contortrix,Eastern Copperhead,Reptilia,912622,Animalia,Chordata,Reptilia
5637248,4/10/17,2017-04-10 15:06:57 UTC,research,36.0036468152,-78.9011439079,,Turdus migratorius,American Robin,Aves,12727,Animalia,Chordata,Aves
5637330,4/10/17,2017-04-10 15:15:04 UTC,research,36.0044338253,-78.9013686213,,Melissa officinalis,lemon balm,Plantae,59901,Plantae,Tracheophyta,Magnoliopsida
5675127,4/13/17,2017-04-13 15:31:04 UTC,research,36.0108566284,-78.9194488525,,Vinca major,greater periwinkle,Plantae,53326,Plantae,Tracheophyta,Magnoliopsida
5675134,4/13/17,2017-04-13 15:29:54 UTC,research,36.0106315613,-78.9194946289,,Trifolium pratense,red clover,Plantae,51875,Plantae,Tracheophyta,Magnoliopsida
5692804,4/14/17,2017-04-14 16:58:20 UTC,research,36.0235445,-78.9272216667,,Xylocopa virginica,Eastern Carpenter Bee,Insecta,51110,Animalia,Arthropoda,Insecta
5788295,4/17/17,2017-04-17 15:00:31 UTC,research,36.0045236723,-78.9013309245,,Equisetum hyemale,rough horsetail,Plantae,52673,Plantae,Tracheophyta,Polypodiopsida
5819406,4/17/17,2017-04-17 22:42:22 UTC,research,36.0116919503,-78.9224717394,,Vitis rotundifolia,muscadine,Plantae,82529,Plantae,Tracheophyta,Magnoliopsida
5819418,4/17/17,2017-04-17 22:44:48 UTC,research,36.0118678864,-78.9226081968,,Mimus polyglottos,Northern Mockingbird,Aves,14886,Animalia,Chordata,Aves
5873520,4/20/17,2017-04-20 16:57:05 UTC,research,36.0241166667,-78.9257133333,,Chrysopilus thoracicus,Golden-backed Snipe Fly,Insecta,61492,Animalia,Arthropoda,Insecta
5873533,4/20/17,2017-04-20 17:10:40 UTC,research,36.0249833333,-78.9235466667,,Harmonia axyridis,Asian Lady Beetle,Insecta,48484,Animalia,Arthropoda,Insecta
5891462,4/21/17,2017-04-21 17:04:48 UTC,research,36.0233471667,-78.9286716667,,Delphinia picta,Common Picture-winged Fly,Insecta,126848,Animalia,Arthropoda,Insecta
5891466,4/21/17,2017-04-21 17:07:13 UTC,research,36.0231945,-78.9292,,Xylocopa virginica,Eastern Carpenter Bee,Insecta,51110,Animalia,Arthropoda,Insecta
5953757,4/25/17,2017-04-25 17:04:02 UTC,research,36.0241861667,-78.9256583333,,Delphinia picta,Common Picture-winged Fly,Insecta,126848,Animalia,Arthropoda,Insecta
5996696,4/28/17,2017-04-28 17:05:02 UTC,research,36.0237055,-78.926025,,Leucauge venusta,Orchard Orbweaver,Arachnida,778499,Animalia,Arthropoda,Arachnida
6024589,4/30/17,,research,36.010929,-78.902455,,Sherardia arvensis,Field madder,Plantae,47691,Plantae,Tracheophyta,Magnoliopsida
6024693,4/30/17,2017-04-30 18:26:41 UTC,research,36.010895879,-78.9025829081,,Trifolium repens,white clover,Plantae,55745,Plantae,Tracheophyta,Magnoliopsida
6024711,4/30/17,,research,36.008154,-78.905343,,Glechoma hederacea,ground-ivy,Plantae,55830,Plantae,Tracheophyta,Magnoliopsida
6024878,4/30/17,2017-04-30 18:45:38 UTC,research,36.0109576956,-78.9025576786,,Salvia lyrata,lyreleaf sage,Plantae,64093,Plantae,Tracheophyta,Magnoliopsida
6024947,4/30/17,2017-04-30 18:49:43 UTC,research,36.010929,-78.902455,,Dioscorea polystachya,Chinese yam,Plantae,119141,Plantae,Tracheophyta,Liliopsida
6024959,4/30/17,2017-04-30 18:50:16 UTC,research,36.01080415,-78.90270157,,Plantago major,greater plantain,Plantae,58961,Plantae,Tracheophyta,Magnoliopsida
6024983,4/30/17,2017-04-30 18:51:57 UTC,research,36.0105776,-78.9026996,,Microstegium vimineum,Japanese stiltgrass,Plantae,116710,Plantae,Tracheophyta,Liliopsida
6024991,4/30/17,2017-04-30 18:52:46 UTC,research,36.010733312,-78.9026289248,,Bombus bimaculatus,Two-spotted Bumble Bee,Insecta,52779,Animalia,Arthropoda,Insecta
6025008,4/30/17,2017-04-30 18:54:05 UTC,research,36.0104627861,-78.902608892,,Toxicodendron radicans,poison ivy,Plantae,58732,Plantae,Tracheophyta,Magnoliopsida
6025017,4/30/17,2017-04-30 18:53:42 UTC,research,36.0106716212,-78.9027054515,,Elaeagnus pungens,thorny olive,Plantae,162214,Plantae,Tracheophyta,Magnoliopsida
6025021,4/30/17,2017-04-30 18:53:05 UTC,research,36.010929,-78.902455,,Juncus effusus,Soft Rush,Plantae,56153,Plantae,Tracheophyta,Liliopsida
6025032,4/30/17,2017-04-30 18:55:06 UTC,research,36.0107577034,-78.9027098101,,Carya illinoinensis,pecan,Plantae,67593,Plantae,Tracheophyta,Magnoliopsida
6025033,4/30/17,2017-04-30 18:53:51 UTC,research,36.01086878,-78.90254982,,Arisaema dracontium,green dragon,Plantae,84261,Plantae,Tracheophyta,Liliopsida
6025042,4/30/17,2017-04-30 18:55:21 UTC,research,36.0104937,-78.9026996,,Potentilla indica,mock strawberry,Plantae,243824,Plantae,Tracheophyta,Magnoliopsida
6025076,4/30/17,2017-04-30 18:56:39 UTC,research,36.0104383529,-78.9026015998,,Parthenocissus quinquefolia,Virginia creeper,Plantae,50278,Plantae,Tracheophyta,Magnoliopsida
6025081,4/30/17,2017-04-30 18:56:52 UTC,research,36.010929,-78.902455,,Acer negundo,boxelder,Plantae,47726,Plantae,Tracheophyta,Magnoliopsida
6025110,4/30/17,2017-04-30 18:57:10 UTC,research,36.0104888,-78.9030975,,Podophyllum peltatum,mayapple,Plantae,49288,Plantae,Tracheophyta,Magnoliopsida
6025116,4/30/17,2017-04-30 18:58:31 UTC,research,36.0104317312,-78.902600091,,Elaeagnus pungens,thorny olive,Plantae,162214,Plantae,Tracheophyta,Magnoliopsida
6025117,4/30/17,2017-04-30 18:58:38 UTC,research,36.010397533,-78.9027295076,,Dioscorea polystachya,Chinese yam,Plantae,119141,Plantae,Tracheophyta,Liliopsida
6025132,4/30/17,2017-04-30 18:59:38 UTC,research,36.0103916237,-78.9027540666,,Liquidambar styraciflua,American sweetgum,Plantae,49658,Plantae,Tracheophyta,Magnoliopsida
6025136,4/30/17,2017-04-30 18:59:23 UTC,research,36.0107422,-78.9022133,,Parthenocissus quinquefolia,Virginia creeper,Plantae,50278,Plantae,Tracheophyta,Magnoliopsida
6025149,4/30/17,2017-04-30 19:00:30 UTC,research,36.01081,-78.902505,,Toxicodendron radicans,poison ivy,Plantae,58732,Plantae,Tracheophyta,Magnoliopsida
6025162,4/30/17,2017-04-30 19:01:42 UTC,research,36.0103811464,-78.9026238118,,Impatiens capensis,common jewelweed,Plantae,47888,Plantae,Tracheophyta,Magnoliopsida
6025163,4/30/17,2017-04-30 19:01:34 UTC,research,36.01078779,-78.90258271,,Clematis virginiana,virgin's-bower,Plantae,62778,Plantae,Tracheophyta,Magnoliopsida
6025184,4/30/17,2017-04-30 19:02:50 UTC,research,36.0104159313,-78.9025466145,,Euonymus fortunei,fortune's spindle,Plantae,130893,Plantae,Tracheophyta,Magnoliopsida
6025193,4/30/17,2017-04-30 19:02:57 UTC,research,36.0103505105,-78.9026703314,,Smilax rotundifolia,roundleaf greenbrier,Plantae,60746,Plantae,Tracheophyta,Liliopsida
6025205,4/30/17,2017-04-30 19:05:07 UTC,research,36.0103817331,-78.9027164318,,Toxicodendron radicans,poison ivy,Plantae,58732,Plantae,Tracheophyta,Magnoliopsida
6025208,4/30/17,2017-04-30 19:04:27 UTC,research,36.01082249,-78.90262684,,Galium aparine,catchweed bedstraw,Plantae,53059,Plantae,Tracheophyta,Magnoliopsida
6025218,4/30/17,2017-04-30 19:06:48 UTC,research,36.0108723,-78.9022575,,Acer floridanum,southern sugar maple,Plantae,48079,Plantae,Tracheophyta,Magnoliopsida
6025238,4/30/17,2017-04-30 19:07:34 UTC,research,36.010697,-78.902537,,Liquidambar styraciflua,American sweetgum,Plantae,49658,Plantae,Tracheophyta,Magnoliopsida
6025259,4/30/17,2017-04-30 19:08:03 UTC,research,36.01033424,-78.90301786,,Clematis virginiana,virgin's-bower,Plantae,62778,Plantae,Tracheophyta,Magnoliopsida
6025286,4/30/17,2017-04-30 19:11:50 UTC,research,36.0096442094,-78.9031383768,,Cardinalis cardinalis,Northern Cardinal,Aves,9083,Animalia,Chordata,Aves
6025329,4/30/17,2017-04-30 19:14:56 UTC,research,36.0103853373,-78.9026083053,,Euonymus americanus,strawberry bush,Plantae,83150,Plantae,Tracheophyta,Magnoliopsida
6025332,4/30/17,2017-04-30 19:13:44 UTC,research,36.01026745,-78.90303623,,Itea virginica,Virginia sweetspire,Plantae,83152,Plantae,Tracheophyta,Magnoliopsida
6025340,4/30/17,2017-04-30 19:14:40 UTC,research,36.010697,-78.902526,,Podophyllum peltatum,mayapple,Plantae,49288,Plantae,Tracheophyta,Magnoliopsida
6025355,4/30/17,2017-04-30 19:16:33 UTC,research,36.010567,-78.902419,,Passiflora lutea,yellow passionflower,Plantae,51450,Plantae,Tracheophyta,Magnoliopsida
6025375,4/30/17,2017-04-30 19:17:54 UTC,research,36.0103986645,-78.9025685751,,Galium aparine,catchweed bedstraw,Plantae,53059,Plantae,Tracheophyta,Magnoliopsida
6025379,4/30/17,2017-04-30 19:17:24 UTC,research,36.01031097,-78.90282435,,Arisaema triphyllum,Jack-in-the-pulpit,Plantae,50310,Plantae,Tracheophyta,Liliopsida
6025382,4/30/17,2017-04-30 19:17:44 UTC,research,36.0110402,-78.9022575,,Campsis radicans,American trumpet vine,Plantae,75995,Plantae,Tracheophyta,Magnoliopsida
6025447,4/30/17,2017-04-30 19:20:43 UTC,research,36.01054,-78.902473,,Polystichum acrostichoides,Christmas fern,Plantae,54412,Plantae,Tracheophyta,Polypodiopsida
6025472,4/30/17,2017-04-30 19:24:39 UTC,research,36.0111242,-78.9022575,,Ilex cornuta,Chinese holly,Plantae,164038,Plantae,Tracheophyta,Magnoliopsida
6025494,4/30/17,2017-04-30 19:26:00 UTC,research,36.01056086,-78.90253647,,Asplenium platyneuron,ebony spleenwort,Plantae,122056,Plantae,Tracheophyta,Polypodiopsida
6025505,4/30/17,2017-04-30 19:27:13 UTC,research,36.010376,-78.902773,,Ilex opaca,American holly,Plantae,60749,Plantae,Tracheophyta,Magnoliopsida
6025506,4/30/17,2017-04-30 19:24:54 UTC,research,36.01005567,-78.90216749,,Styrax grandifolius,Bigleaf Snowbell,Plantae,169427,Plantae,Tracheophyta,Magnoliopsida
6025526,4/30/17,2017-04-30 19:28:22 UTC,research,36.010445,-78.90272,,Euonymus americanus,strawberry bush,Plantae,83150,Plantae,Tracheophyta,Magnoliopsida
6025565,4/30/17,2017-04-30 19:30:46 UTC,research,36.0110402,-78.9022575,,Euonymus fortunei,fortune's spindle,Plantae,130893,Plantae,Tracheophyta,Magnoliopsida
6025598,4/30/17,2017-04-30 19:32:07 UTC,research,36.0103646759,-78.9027092234,,Cercis canadensis,eastern redbud,Plantae,48502,Plantae,Tracheophyta,Magnoliopsida
6025612,4/30/17,2017-04-30 19:31:50 UTC,research,36.010376,-78.90273,,Liriodendron tulipifera,tulip tree,Plantae,53582,Plantae,Tracheophyta,Magnoliopsida
6025648,4/30/17,2017-04-30 19:30:49 UTC,research,36.0101425,-78.90239394,,Euonymus americanus,strawberry bush,Plantae,83150,Plantae,Tracheophyta,Magnoliopsida
6025864,4/30/17,2017-04-30 19:41:43 UTC,research,36.0102997162,-78.9026123286,,Sassafras albidum,sassafras,Plantae,54795,Plantae,Tracheophyta,Magnoliopsida
6025887,4/30/17,2017-04-30 19:42:08 UTC,research,36.0101875663,-78.9025500511,,Sassafras albidum,sassafras,Plantae,54795,Plantae,Tracheophyta,Magnoliopsida
6025921,4/30/17,2017-04-30 19:42:02 UTC,research,36.01006578,-78.90249712,,Youngia japonica,Oriental false hawksbeard,Plantae,127066,Plantae,Tracheophyta,Magnoliopsida
6026003,4/30/17,2017-04-30 19:48:46 UTC,research,36.0101734847,-78.9027071279,,Euonymus americanus,strawberry bush,Plantae,83150,Plantae,Tracheophyta,Magnoliopsida
6026017,4/30/17,2017-04-30 19:49:34 UTC,research,36.0099452,-78.9017712,,Sassafras albidum,sassafras,Plantae,54795,Plantae,Tracheophyta,Magnoliopsida
6026052,4/30/17,2017-04-30 19:52:48 UTC,research,36.010428,-78.902677,,Itea virginica,Virginia sweetspire,Plantae,83152,Plantae,Tracheophyta,Magnoliopsida
6026053,4/30/17,2017-04-30 19:50:52 UTC,research,36.0102769174,-78.9027910308,,Sanguinaria canadensis,bloodroot,Plantae,51044,Plantae,Tracheophyta,Magnoliopsida
6026092,4/30/17,2017-04-30 19:57:54 UTC,research,36.0103651369,-78.9027559944,,Passiflora lutea,yellow passionflower,Plantae,51450,Plantae,Tracheophyta,Magnoliopsida
6026118,4/30/17,2017-04-30 19:58:41 UTC,research,36.0103469063,-78.9027258196,,Botrypus virginianus,rattlesnake fern,Plantae,75855,Plantae,Tracheophyta,Polypodiopsida
6026339,4/30/17,2017-04-30 20:14:30 UTC,research,36.0108039715,-78.9026537352,,Glechoma hederacea,ground-ivy,Plantae,55830,Plantae,Tracheophyta,Magnoliopsida
6037222,5/1/17,2017-05-01 15:12:23 UTC,research,36.0050735667,-78.9012619282,,Vinca major,greater periwinkle,Plantae,53326,Plantae,Tracheophyta,Magnoliopsida
6037338,5/1/17,2017-05-01 15:18:58 UTC,research,36.0050500147,-78.9007123362,,Parthenocissus quinquefolia,Virginia creeper,Plantae,50278,Plantae,Tracheophyta,Magnoliopsida
6037340,5/1/17,2017-05-01 15:15:36 UTC,research,36.0046301966,-78.9008144234,,Hedera helix,common ivy,Plantae,55882,Plantae,Tracheophyta,Magnoliopsida
6037349,5/1/17,2017-05-01 15:17:51 UTC,research,36.0046664974,-78.900605652,,Taraxacum officinale,common dandelion,Plantae,47602,Plantae,Tracheophyta,Magnoliopsida
6037356,5/1/17,2017-05-01 15:18:52 UTC,research,36.0047779968,-78.9005074977,,Trifolium repens,white clover,Plantae,55745,Plantae,Tracheophyta,Magnoliopsida
6037358,5/1/17,2017-05-01 15:19:17 UTC,research,36.0044470642,-78.9009417394,,Taraxacum officinale,common dandelion,Plantae,47602,Plantae,Tracheophyta,Magnoliopsida
6105214,5/5/17,2017-05-05 16:51:35 UTC,research,36.0240666667,-78.92572,,Potentilla indica,mock strawberry,Plantae,243824,Plantae,Tracheophyta,Magnoliopsida
6161816,5/10/17,2017-05-10 17:36:20 UTC,research,36.0232695,-78.9291533333,,Psychomorpha epimenis,Grapevine Epimenis Moth,Insecta,60774,Animalia,Arthropoda,Insecta
6183218,5/12/17,2017-05-12 17:20:52 UTC,research,36.0236055,-78.9278033333,,Orgyia leucostigma,White-marked Tussock Moth,Insecta,81665,Animalia,Arthropoda,Insecta
6245982,5/17/17,2017-05-17 11:37:46 UTC,research,36.0061394486,-78.8519183536,,Actias luna,North American Luna Moth,Insecta,47916,Animalia,Arthropoda,Insecta
6261289,5/18/17,2017-05-18 17:07:01 UTC,research,36.0237416667,-78.9272383333,,Diabrotica undecimpunctata,Spotted Cucumber Beetle,Insecta,55487,Animalia,Arthropoda,Insecta
6273156,5/19/17,2017-05-19 17:04:58 UTC,research,36.0237721667,-78.9272466667,,Arilus cristatus,Wheel Bug,Insecta,48957,Animalia,Arthropoda,Insecta
6275486,5/19/17,2017-05-19 19:47:54 UTC,research,36.03021299,-78.89776386,,Labidomera clivicollis,Swamp Milkweed Leaf Beetle,Insecta,82582,Animalia,Arthropoda,Insecta
6275490,5/19/17,2017-05-19 19:48:49 UTC,research,36.0302336,-78.8975497,,Tetraopes tetrophthalmus,Red Milkweed Beetle,Insecta,118559,Animalia,Arthropoda,Insecta
6320629,5/22/17,2017-05-22 17:11:15 UTC,research,36.0234805,-78.9278416667,,Chauliognathus marginatus,Margined Leatherwing Beetle,Insecta,84040,Animalia,Arthropoda,Insecta
6335575,5/23/17,2017-05-23 16:58:27 UTC,research,36.0233778333,-78.928245,,Sylvilagus floridanus,Eastern Cottontail,Mammalia,43111,Animalia,Chordata,Mammalia
6335576,5/23/17,2017-05-23 16:42:21 UTC,research,36.0232388333,-78.929245,,Philoscia muscorum,Common Striped Woodlouse,Animalia,48292,Animalia,Arthropoda,Malacostraca
6349530,5/19/17,2017-05-19 07:01:56 UTC,research,36.0260249209,-78.8970278856,,Didelphis virginiana,Virginia Opossum,Mammalia,42652,Animalia,Chordata,Mammalia
6350450,5/24/17,2017-05-24 13:36:43 UTC,research,36.0039481614,-78.9009818808,,Passer domesticus,House Sparrow,Aves,13858,Animalia,Chordata,Aves
6358078,5/25/17,2017-05-25 17:19:01 UTC,research,36.0235416667,-78.9279166667,,Diabrotica undecimpunctata,Spotted Cucumber Beetle,Insecta,55487,Animalia,Arthropoda,Insecta
6365150,5/25/17,2017-05-26 03:53:44 UTC,research,36.0260944069,-78.8970549592,,Eutrapela clemataria,Curved-toothed Geometer Moth,Insecta,205197,Animalia,Arthropoda,Insecta
6402960,5/28/17,2017-05-28 18:01:34 UTC,research,36.0451,-78.821806,,Alliaria petiolata,garlic mustard,Plantae,56061,Plantae,Tracheophyta,Magnoliopsida
6415718,5/29/17,2017-05-29 14:48:02 UTC,research,36.00474445,-78.901305,,Echinacea purpurea,purple coneflower,Plantae,48627,Plantae,Tracheophyta,Magnoliopsida
6415741,5/29/17,2017-05-29 14:45:41 UTC,research,36.02463579,-78.86765932,,Alliaria petiolata,garlic mustard,Plantae,56061,Plantae,Tracheophyta,Magnoliopsida
6416102,5/29/17,2017-05-29 15:15:49 UTC,research,36.02713274,-78.86582045,,Alliaria petiolata,garlic mustard,Plantae,56061,Plantae,Tracheophyta,Magnoliopsida
6416169,5/29/17,2017-05-29 15:23:08 UTC,research,36.0300338,-78.8759488,,Alliaria petiolata,garlic mustard,Plantae,56061,Plantae,Tracheophyta,Magnoliopsida
6416616,5/29/17,2017-05-29 16:23:34 UTC,research,36.02488836,-78.86715722,,Alliaria petiolata,garlic mustard,Plantae,56061,Plantae,Tracheophyta,Magnoliopsida
6417182,5/29/17,2017-05-29 17:03:32 UTC,research,36.02359976,-78.86837237,,Alliaria petiolata,garlic mustard,Plantae,56061,Plantae,Tracheophyta,Magnoliopsida
6417729,5/29/17,2017-05-29 17:39:34 UTC,research,36.0222081,-78.86996735,,Alliaria petiolata,garlic mustard,Plantae,56061,Plantae,Tracheophyta,Magnoliopsida
6433989,5/30/17,2017-05-30 19:39:39 UTC,research,36.0074838,-78.9039865,,Alliaria petiolata,garlic mustard,Plantae,56061,Plantae,Tracheophyta,Magnoliopsida
6480223,6/3/17,2017-06-03 15:50:55 UTC,research,36.05479485,-78.84709538,,Alliaria petiolata,garlic mustard,Plantae,56061,Plantae,Tracheophyta,Magnoliopsida
6494056,6/4/17,2017-06-04 15:56:27 UTC,research,36.01648775,-78.88315775,,Alliaria petiolata,garlic mustard,Plantae,56061,Plantae,Tracheophyta,Magnoliopsida
6530733,9/6/16,2016-09-06 12:00:58 UTC,research,36.0060826067,-78.8538515559,,Odocoileus virginianus,White-tailed Deer,Mammalia,42223,Animalia,Chordata,Mammalia
6551892,6/8/17,2017-06-08 16:54:31 UTC,research,36.0238083333,-78.9270466667,,Cephalanthus occidentalis,buttonbush,Plantae,52763,Plantae,Tracheophyta,Magnoliopsida
6562160,6/9/17,2017-06-09 16:35:35 UTC,research,36.0242166667,-78.9257366667,,Rhodobaenus quinquepunctatus,Cocklebur Weevil,Insecta,230013,Animalia,Arthropoda,Insecta
6562163,6/9/17,2017-06-09 16:43:20 UTC,research,36.0244111667,-78.9252783333,,Popillia japonica,Japanese Beetle,Insecta,67760,Animalia,Arthropoda,Insecta
6624659,6/13/17,2017-06-13 14:29:00 UTC,research,36.0154338333,-78.919203,,Pyxine sorediata,Pyxine Lichen,Fungi,229702,Fungi,Ascomycota,Lecanoromycetes
6653083,6/14/17,2017-06-14 16:49:24 UTC,research,36.0242833333,-78.9255616667,,Harmonia axyridis,Asian Lady Beetle,Insecta,48484,Animalia,Arthropoda,Insecta
6732568,6/20/17,2017-06-20 17:08:05 UTC,research,36.0234805,-78.9283216667,,Apis mellifera,Western Honey Bee,Insecta,47219,Animalia,Arthropoda,Insecta
6732585,6/19/17,2017-06-19 16:37:05 UTC,research,36.0234805,-78.928305,,Bombus griseocollis,Brown-belted Bumble Bee,Insecta,120215,Animalia,Arthropoda,Insecta
6744577,6/21/17,2017-06-21 16:56:01 UTC,research,36.0242945,-78.9255833333,,Argia fumipennis violacea,Violet Dancer,Insecta,119014,Animalia,Arthropoda,Insecta
6755280,6/21/17,2017-06-21 22:45:00 UTC,research,36.0109773889,-78.9321106944,,Felis catus,Domestic Cat,Mammalia,118552,Animalia,Chordata,Mammalia
6755283,6/21/17,2017-06-21 22:45:00 UTC,research,36.0110585833,-78.9318627778,,Lonicera japonica,Japanese honeysuckle,Plantae,77835,Plantae,Tracheophyta,Magnoliopsida
6755302,6/21/17,2017-06-21 22:45:00 UTC,research,36.0110585833,-78.9318627778,,Quercus phellos,willow oak,Plantae,119983,Plantae,Tracheophyta,Magnoliopsida
6755329,6/21/17,2017-06-21 22:40:00 UTC,research,36.0099017778,-78.9312543889,,Hedera helix,common ivy,Plantae,55882,Plantae,Tracheophyta,Magnoliopsida
6755330,6/21/17,2017-06-21 22:40:00 UTC,research,36.0099017778,-78.9312543889,,Trifolium pratense,red clover,Plantae,51875,Plantae,Tracheophyta,Magnoliopsida
6755333,6/22/17,2017-06-22 17:09:55 UTC,research,36.05946832,-78.83341298,,Asimina triloba,common pawpaw,Plantae,50897,Plantae,Tracheophyta,Magnoliopsida
6755347,6/21/17,2017-06-21 22:33:00 UTC,research,36.0107547778,-78.9316327778,,Plantago lanceolata,ribwort plantain,Plantae,53178,Plantae,Tracheophyta,Magnoliopsida
6755383,6/21/17,2017-06-21 22:36:00 UTC,research,36.0109510833,-78.9320616944,,Quercus phellos,willow oak,Plantae,119983,Plantae,Tracheophyta,Magnoliopsida
6755478,6/22/17,2017-06-22 17:23:35 UTC,research,36.05941628,-78.83211543,,Arisaema triphyllum,Jack-in-the-pulpit,Plantae,50310,Plantae,Tracheophyta,Liliopsida
6755970,6/22/17,2017-06-22 17:30:41 UTC,research,36.05934456,-78.83213629,,Alliaria petiolata,garlic mustard,Plantae,56061,Plantae,Tracheophyta,Magnoliopsida
6756545,6/21/17,2017-06-21 22:39:00 UTC,research,36.0099017778,-78.9312543889,,Quercus phellos,willow oak,Plantae,119983,Plantae,Tracheophyta,Magnoliopsida
6756574,6/21/17,2017-06-21 22:37:00 UTC,research,36.0109795833,-78.9320285,,Euonymus fortunei,fortune's spindle,Plantae,130893,Plantae,Tracheophyta,Magnoliopsida
6756575,6/21/17,2017-06-21 22:38:00 UTC,research,36.0099017778,-78.9312543889,,Trifolium arvense,rabbitfoot clover,Plantae,79408,Plantae,Tracheophyta,Magnoliopsida
6756576,6/21/17,2017-06-21 22:38:00 UTC,research,36.010905,-78.9320175,,Trifolium repens,white clover,Plantae,55745,Plantae,Tracheophyta,Magnoliopsida
6766299,6/23/17,2017-06-23 16:07:56 UTC,research,36.01984614,-78.87507821,,Alliaria petiolata,garlic mustard,Plantae,56061,Plantae,Tracheophyta,Magnoliopsida
6766994,6/23/17,2017-06-23 16:40:17 UTC,research,36.0235971667,-78.92672,,Toxomerus geminatus,Eastern Calligrapher,Insecta,126532,Animalia,Arthropoda,Insecta
6767004,6/23/17,2017-06-23 16:53:34 UTC,research,36.0234416667,-78.9282916667,,Apis mellifera,Western Honey Bee,Insecta,47219,Animalia,Arthropoda,Insecta
6776229,6/24/17,2017-06-24 14:44:08 UTC,research,36.0306637595,-78.8973603119,,Coleomegilla maculata,Spotted Pink Ladybeetle,Insecta,126267,Animalia,Arthropoda,Insecta
6776298,6/24/17,2017-06-24 14:50:46 UTC,research,36.0253420689,-78.8965090335,,Apis mellifera,Western Honey Bee,Insecta,47219,Animalia,Arthropoda,Insecta
6799156,6/25/17,2017-06-25 14:59:00 UTC,research,36.0108513611,-78.9260405556,,Helenium amarum,Bitterweed,Plantae,77348,Plantae,Tracheophyta,Magnoliopsida
6799160,6/25/17,2017-06-25 15:00:00 UTC,research,36.0107371667,-78.9260985556,,Plantago lanceolata,ribwort plantain,Plantae,53178,Plantae,Tracheophyta,Magnoliopsida
6801539,6/24/17,2017-06-24 11:56:47 UTC,research,36.0209910446,-78.920265957,,Commelina communis ludens,,Plantae,240098,Plantae,Tracheophyta,Liliopsida
6807008,6/25/17,2017-06-25 15:09:00 UTC,research,36.0132605,-78.8869152778,,Plantago aristata,bracted plantain,Plantae,78616,Plantae,Tracheophyta,Magnoliopsida
6816465,6/25/17,2017-06-25 15:02:00 UTC,research,36.0106927778,-78.9259116111,,Trifolium pratense,red clover,Plantae,51875,Plantae,Tracheophyta,Magnoliopsida
6816620,6/25/17,2017-06-25 15:05:00 UTC,research,36.0104313889,-78.9264638056,,Plantago aristata,bracted plantain,Plantae,78616,Plantae,Tracheophyta,Magnoliopsida
6816621,6/25/17,2017-06-25 15:06:00 UTC,research,36.0106815833,-78.9260064722,,Quercus phellos,willow oak,Plantae,119983,Plantae,Tracheophyta,Magnoliopsida
6816622,6/25/17,2017-06-25 15:06:00 UTC,research,36.0104913889,-78.9266695,,Albizia julibrissin,Persian silk tree,Plantae,47443,Plantae,Tracheophyta,Magnoliopsida
6816944,6/25/17,2017-06-25 15:08:00 UTC,research,36.0102982778,-78.9266252778,,Campsis radicans,American trumpet vine,Plantae,75995,Plantae,Tracheophyta,Magnoliopsida
6829552,6/25/17,2017-06-25 15:07:00 UTC,research,36.0105983889,-78.9266915833,,Plantago aristata,bracted plantain,Plantae,78616,Plantae,Tracheophyta,Magnoliopsida
6877047,7/1/17,2017-07-01 16:25:00 UTC,research,36.0183056944,-78.9280569444,,Plantago major,greater plantain,Plantae,58961,Plantae,Tracheophyta,Magnoliopsida
6877414,7/1/17,2017-07-01 16:18:00 UTC,research,36.01859,-78.9279733889,,Passiflora lutea,yellow passionflower,Plantae,51450,Plantae,Tracheophyta,Magnoliopsida
6877475,7/1/17,2017-07-01 15:59:00 UTC,research,36.0106736944,-78.9229358889,,Magnolia grandiflora,southern magnolia,Plantae,83074,Plantae,Tracheophyta,Magnoliopsida
6877476,7/1/17,2017-07-01 15:59:00 UTC,research,36.0105382778,-78.9228846667,,Plantago lanceolata,ribwort plantain,Plantae,53178,Plantae,Tracheophyta,Magnoliopsida
6877496,7/1/17,2017-07-01 16:20:00 UTC,research,36.0185214444,-78.9281394444,,Chimaphila maculata,striped wintergreen,Plantae,82358,Plantae,Tracheophyta,Magnoliopsida
6877498,7/1/17,2017-07-01 16:19:00 UTC,research,36.0184573889,-78.9281280833,,Strix varia,Barred Owl,Aves,19893,Animalia,Chordata,Aves
6877522,7/1/17,2017-07-01 16:23:00 UTC,research,36.0186653889,-78.9280635,,Usnea strigosa,Bushy beard lichen,Fungi,121176,Fungi,Ascomycota,Lecanoromycetes
6877616,7/1/17,2017-07-01 15:55:00 UTC,research,36.0105802222,-78.9228483333,,Magnolia grandiflora,southern magnolia,Plantae,83074,Plantae,Tracheophyta,Magnoliopsida
6877618,7/1/17,2017-07-01 15:56:00 UTC,research,36.0106291389,-78.9228627222,,Quercus phellos,willow oak,Plantae,119983,Plantae,Tracheophyta,Magnoliopsida
6877621,7/1/17,2017-07-01 15:56:00 UTC,research,36.0106628611,-78.9228898611,,Lonicera japonica,Japanese honeysuckle,Plantae,77835,Plantae,Tracheophyta,Magnoliopsida
6877622,7/1/17,2017-07-01 15:56:00 UTC,research,36.01069925,-78.9228377222,,Hedera helix,common ivy,Plantae,55882,Plantae,Tracheophyta,Magnoliopsida
6877623,7/1/17,2017-07-01 15:56:00 UTC,research,36.01071375,-78.9228278889,,Toxicodendron radicans,poison ivy,Plantae,58732,Plantae,Tracheophyta,Magnoliopsida
6878217,7/1/17,2017-07-01 15:58:00 UTC,research,36.0107525833,-78.9228309444,,Paspalum dilatatum,Dallis grass,Plantae,60295,Plantae,Tracheophyta,Liliopsida
6878219,7/1/17,2017-07-01 16:27:00 UTC,research,36.0181203611,-78.9281253889,,Lepidium virginicum,Virginia pepperweed,Plantae,77676,Plantae,Tracheophyta,Magnoliopsida
6878296,7/1/17,2017-07-01 15:55:00 UTC,research,36.0105781944,-78.9228587222,,Toxicodendron radicans,poison ivy,Plantae,58732,Plantae,Tracheophyta,Magnoliopsida
6878297,7/1/17,2017-07-01 15:55:00 UTC,research,36.01055,-78.9228651944,,Smilax rotundifolia,roundleaf greenbrier,Plantae,60746,Plantae,Tracheophyta,Liliopsida
6907882,7/3/17,2017-07-03 15:26:31 UTC,research,36.0295610782,-78.9182853141,,Passer domesticus,House Sparrow,Aves,13858,Animalia,Chordata,Aves
6928861,7/5/17,2017-07-05 13:30:23 UTC,research,36.0046472167,-78.901275,,Erynnis horatius,Horace's Duskywing,Insecta,50071,Animalia,Arthropoda,Insecta
6931406,7/5/17,2017-07-05 16:37:54 UTC,research,36.0233888333,-78.9285883333,,Labidomera clivicollis,Swamp Milkweed Leaf Beetle,Insecta,82582,Animalia,Arthropoda,Insecta
6931407,7/5/17,2017-07-05 16:53:35 UTC,research,36.0237805,-78.927825,,Lerema accius,Clouded Skipper,Insecta,142988,Animalia,Arthropoda,Insecta
6931419,7/5/17,2017-07-05 17:00:30 UTC,research,36.0238695,-78.9292616667,,Phyllopalpus pulchellus,Red-headed Bush Cricket,Insecta,84403,Animalia,Arthropoda,Insecta
7025711,7/12/17,2017-07-12 16:45:01 UTC,research,36.0234721667,-78.9279783333,,Dichromorpha viridis,Short-winged Green Grasshopper,Insecta,146635,Animalia,Arthropoda,Insecta
7025716,7/12/17,2017-07-12 16:55:03 UTC,research,36.0242805,-78.9256216667,,Phyciodes tharos,Pearl Crescent,Insecta,52925,Animalia,Arthropoda,Insecta
7058476,7/14/17,2017-07-15 02:05:17 UTC,research,36.021175,-78.8948216667,,Strix varia,Barred Owl,Aves,19893,Animalia,Chordata,Aves
7192644,7/24/17,2017-07-24 16:47:35 UTC,research,36.0242666667,-78.925605,,Scolia bicincta,Double-banded Scoliid Wasp,Insecta,119988,Animalia,Arthropoda,Insecta
7192646,7/24/17,2017-07-24 16:54:50 UTC,research,36.0234945,-78.9292833333,,Argiope aurantia,Yellow Garden Spider,Arachnida,67707,Animalia,Arthropoda,Arachnida
7213909,7/25/17,2017-07-25 16:51:00 UTC,research,36.0126800537,-78.9285812378,,Artemisia vulgaris,common mugwort,Plantae,52856,Plantae,Tracheophyta,Magnoliopsida
7213920,7/25/17,2017-07-25 16:54:55 UTC,research,36.012802124,-78.9287490845,,Helenium amarum,Bitterweed,Plantae,77348,Plantae,Tracheophyta,Magnoliopsida
7213946,7/25/17,2017-07-25 16:50:34 UTC,research,36.0127296448,-78.9285964966,,Magnolia grandiflora,southern magnolia,Plantae,83074,Plantae,Tracheophyta,Magnoliopsida
7213951,7/25/17,2017-07-25 16:50:10 UTC,research,36.0127296448,-78.9285888672,,Toxicodendron radicans,poison ivy,Plantae,58732,Plantae,Tracheophyta,Magnoliopsida
7213972,7/25/17,2017-07-25 16:50:51 UTC,research,36.0127296448,-78.9285964966,,Liquidambar styraciflua,American sweetgum,Plantae,49658,Plantae,Tracheophyta,Magnoliopsida
7213981,7/25/17,2017-07-25 16:49:42 UTC,research,36.0127563477,-78.928604126,,Magnolia grandiflora,southern magnolia,Plantae,83074,Plantae,Tracheophyta,Magnoliopsida
7214048,7/25/17,2017-07-25 16:47:40 UTC,research,36.0128211975,-78.9285736084,,Quercus phellos,willow oak,Plantae,119983,Plantae,Tracheophyta,Magnoliopsida
7214059,7/25/17,2017-07-25 16:45:44 UTC,research,36.0128135681,-78.9290237427,,Juniperus virginiana,eastern redcedar,Plantae,49399,Plantae,Tracheophyta,Pinopsida
7219609,7/26/17,2017-07-26 16:50:51 UTC,research,36.0235111667,-78.929245,,Argiope aurantia,Yellow Garden Spider,Arachnida,67707,Animalia,Arthropoda,Arachnida
7228502,7/25/17,2017-07-25 16:52:54 UTC,research,36.0126647949,-78.9288330078,,Microstegium vimineum,Japanese stiltgrass,Plantae,116710,Plantae,Tracheophyta,Liliopsida
7228647,7/25/17,2017-07-25 16:52:47 UTC,research,36.0126991272,-78.9288482666,,Quercus phellos,willow oak,Plantae,119983,Plantae,Tracheophyta,Magnoliopsida
7228664,7/25/17,2017-07-25 16:47:09 UTC,research,36.0128479004,-78.9286804199,,Liquidambar styraciflua,American sweetgum,Plantae,49658,Plantae,Tracheophyta,Magnoliopsida
7234092,7/27/17,2017-07-27 16:24:56 UTC,research,36.0235945,-78.9293533333,,Micrathena sagittata,Arrow-shaped Orbweaver,Arachnida,120578,Animalia,Arthropoda,Arachnida
7234098,7/26/17,2017-07-26 16:41:14 UTC,research,36.0242888333,-78.9256533333,,Sphex pensylvanicus,Great Black Digger Wasp,Insecta,48738,Animalia,Arthropoda,Insecta
7243290,7/27/17,2017-07-28 00:54:54 UTC,research,36.0308416667,-78.8976666667,,Feltia subterranea,Subterranean Dart,Insecta,152979,Animalia,Arthropoda,Insecta
7248094,7/28/17,2017-07-28 16:59:33 UTC,research,36.0235416667,-78.9293133333,,Argiope aurantia,Yellow Garden Spider,Arachnida,67707,Animalia,Arthropoda,Arachnida
7254750,7/28/17,2017-07-28 15:22:00 UTC,research,36.0141566111,-78.9336167222,,Euphorbia maculata,Spotted spurge,Plantae,58893,Plantae,Tracheophyta,Magnoliopsida
7295025,7/31/17,2017-07-31 16:38:42 UTC,research,36.001125,-78.9018083333,,Sphecius speciosus,Eastern Cicada-killer Wasp,Insecta,51954,Animalia,Arthropoda,Insecta
7308479,8/1/17,2017-08-01 16:44:37 UTC,research,36.0239971667,-78.92665,,Vespula maculifrons,Eastern Yellowjacket,Insecta,119994,Animalia,Arthropoda,Insecta
7308482,8/1/17,2017-08-01 16:38:16 UTC,research,36.0242666667,-78.9256583333,,Scolia bicincta,Double-banded Scoliid Wasp,Insecta,119988,Animalia,Arthropoda,Insecta
7311743,7/15/17,2017-07-15 19:52:03 UTC,research,36.0252611667,-78.929405,,Hemaris diffinis,Snowberry Clearwing,Insecta,358549,Animalia,Arthropoda,Insecta
7311744,7/26/17,2017-07-26 13:22:17 UTC,research,36.0251721667,-78.9296333333,,Bombus impatiens,Common Eastern Bumble Bee,Insecta,118970,Animalia,Arthropoda,Insecta
7311746,7/26/17,2017-07-26 22:10:05 UTC,research,36.0248971667,-78.92942,,Epargyreus clarus,Silver-spotted Skipper,Insecta,81559,Animalia,Arthropoda,Insecta
7311749,7/17/17,2017-07-17 22:21:43 UTC,research,36.02475,-78.9293583333,,Bombus impatiens,Common Eastern Bumble Bee,Insecta,118970,Animalia,Arthropoda,Insecta
7311752,7/16/17,2017-07-16 18:59:02 UTC,research,36.0252305,-78.9294883333,,Papilio glaucus,Eastern Tiger Swallowtail,Insecta,60551,Animalia,Arthropoda,Insecta
7311765,7/28/17,2017-07-28 13:41:22 UTC,research,36.0252028333,-78.92948,,Vanessa cardui,Painted Lady,Insecta,48548,Animalia,Arthropoda,Insecta
7311793,7/30/17,2017-07-30 17:34:12 UTC,research,36.0251583333,-78.92948,,Atalopedes campestris,Sachem,Insecta,52075,Animalia,Arthropoda,Insecta
7314919,8/1/17,2017-08-02 00:06:40 UTC,research,36.0168083333,-78.9293583333,,Argiope aurantia,Yellow Garden Spider,Arachnida,67707,Animalia,Arthropoda,Arachnida
7318824,8/2/17,2017-08-02 14:00:53 UTC,research,36.0248971667,-78.9295883333,,Asclepias tuberosa,butterfly milkweed,Plantae,47912,Plantae,Tracheophyta,Magnoliopsida
7319549,3/30/14,2014-03-30 21:53:55 UTC,research,36.0249257264,-78.9297780238,,Strix varia,Barred Owl,Aves,19893,Animalia,Chordata,Aves
7319627,5/13/17,2017-05-13 16:15:10 UTC,research,36.0253528333,-78.92968,,Graphocephala coccinea,Red-banded Leafhopper,Insecta,56925,Animalia,Arthropoda,Insecta
7324989,8/2/17,2017-08-02 22:50:53 UTC,research,36.0248,-78.9296116667,,Archilochus colubris,Ruby-throated Hummingbird,Aves,6432,Animalia,Chordata,Aves
7325874,8/2/17,2017-08-03 00:04:09 UTC,research,36.0032722167,-78.89373,,Antheraea polyphemus,Polyphemus Moth,Insecta,47919,Animalia,Arthropoda,Insecta
7348709,8/4/17,2017-08-04 16:44:59 UTC,research,36.0235583333,-78.92733,,Zelus luridus,Pale Green Assassin Bug,Insecta,129423,Animalia,Arthropoda,Insecta
7348735,8/3/17,2017-08-03 17:33:05 UTC,research,36.0242528333,-78.9256533333,,Strymon melinus,Gray Hairstreak,Insecta,50931,Animalia,Arthropoda,Insecta
7361771,7/24/17,2017-07-24 19:19:50 UTC,research,36.0222374543,-78.9027253155,,Peucetia viridans,Green Lynx Spider,Arachnida,126777,Animalia,Arthropoda,Arachnida
7374262,8/6/17,2017-08-06 13:58:09 UTC,research,36.01502467,-78.91868229,,Parthenocissus quinquefolia,Virginia creeper,Plantae,50278,Plantae,Tracheophyta,Magnoliopsida
7379466,8/6/17,2017-08-06 19:03:21 UTC,research,36.0251833333,-78.9295283333,,Phyciodes tharos,Pearl Crescent,Insecta,52925,Animalia,Arthropoda,Insecta
7436282,8/9/17,2017-08-09 17:13:32 UTC,research,36.0243305,-78.9256366667,,Megacyllene robiniae,Locust Borer,Insecta,83802,Animalia,Arthropoda,Insecta
7436287,8/10/17,2017-08-10 17:14:00 UTC,research,36.0236971667,-78.9292833333,,Asterocampa celtis,Hackberry Emperor,Insecta,68264,Animalia,Arthropoda,Insecta
7436290,8/7/17,2017-08-07 16:46:37 UTC,research,36.0243083333,-78.925675,,Delphinia picta,Common Picture-winged Fly,Insecta,126848,Animalia,Arthropoda,Insecta
7446214,8/11/17,2017-08-11 13:00:58 UTC,research,36.01837041,-78.881206,,Aralia spinosa,devil's walkingstick,Plantae,82813,Plantae,Tracheophyta,Magnoliopsida
7447211,8/11/17,2017-08-11 14:29:40 UTC,research,36.0313861667,-78.89705,,Anisota peigleri,Yellow-striped Oakworm Moth,Insecta,48266,Animalia,Arthropoda,Insecta
7447298,8/11/17,2017-08-11 15:11:03 UTC,research,36.0323111667,-78.8950116667,,Perithemis tenera,Eastern Amberwing,Insecta,59776,Animalia,Arthropoda,Insecta
7447320,8/11/17,2017-08-11 15:10:59 UTC,research,36.0323111667,-78.8950116667,,Pachydiplax longipennis,Blue Dasher,Insecta,59774,Animalia,Arthropoda,Insecta
7447829,8/11/17,2017-08-11 15:37:17 UTC,research,36.03185,-78.8950716667,,Vespula maculifrons,Eastern Yellowjacket,Insecta,119994,Animalia,Arthropoda,Insecta
7448083,8/11/17,2017-08-11 16:03:57 UTC,research,36.0316695,-78.8953033333,,Libellula vibrans,Great Blue Skimmer,Insecta,104586,Animalia,Arthropoda,Insecta
7449236,8/11/17,2017-08-11 17:05:38 UTC,research,36.0234638333,-78.9279033333,,Erythemis simplicicollis,Eastern Pondhawk,Insecta,61495,Animalia,Arthropoda,Insecta
7462494,8/11/17,2017-08-11 13:10:51 UTC,research,36.01854721,-78.88128574,,Asimina triloba,common pawpaw,Plantae,50897,Plantae,Tracheophyta,Magnoliopsida
7478592,6/21/17,2017-06-21 22:33:00 UTC,research,36.0107506111,-78.9316228889,,Trifolium pratense,red clover,Plantae,51875,Plantae,Tracheophyta,Magnoliopsida
7478619,6/21/17,2017-06-21 22:34:00 UTC,research,36.0107613889,-78.9317181111,,Trifolium pratense,red clover,Plantae,51875,Plantae,Tracheophyta,Magnoliopsida
7484430,8/5/17,2017-08-05 19:20:19 UTC,research,36.0252083333,-78.92952,,Amorpha juglandis,Walnut Sphinx,Insecta,84023,Animalia,Arthropoda,Insecta
7486498,8/13/17,2017-08-14 02:14:35 UTC,research,36.0261166189,-78.8969771751,,Hymenia perspectalis,Spotted Beet Webworm Moth,Insecta,142995,Animalia,Arthropoda,Insecta
7486516,8/13/17,2017-08-14 02:18:03 UTC,research,36.0261255456,-78.897035597,,Epimecis hortaria,Tulip-tree Beauty,Insecta,83090,Animalia,Arthropoda,Insecta
7501024,8/14/17,2017-08-15 01:19:48 UTC,research,36.021716455,-78.8975912333,,Agkistrodon contortrix,Eastern Copperhead,Reptilia,912622,Animalia,Chordata,Reptilia
7538654,8/16/17,2017-08-16 14:57:55 UTC,research,36.0314203939,-78.9343125188,,Cyrilla racemiflora,Swamp titi,Plantae,161508,Plantae,Tracheophyta,Magnoliopsida
7538665,8/16/17,2017-08-16 15:05:15 UTC,research,36.0314719426,-78.9343113453,,Juncus effusus,Soft Rush,Plantae,56153,Plantae,Tracheophyta,Liliopsida
7538677,8/16/17,2017-08-16 15:13:23 UTC,research,36.0315026204,-78.9342004527,,Lobelia cardinalis,cardinal flower,Plantae,48038,Plantae,Tracheophyta,Magnoliopsida
7538692,8/16/17,2017-08-16 15:21:32 UTC,research,36.0315598687,-78.9341668413,,Papilio polyxenes,Black Swallowtail,Insecta,58523,Animalia,Arthropoda,Insecta
7604896,8/18/17,2017-08-18 16:07:43 UTC,research,36.0260241665,-78.8969403785,,Lithobates palustris,Pickerel Frog,Amphibia,66002,Animalia,Chordata,Amphibia
7604929,8/20/17,2017-08-20 19:35:46 UTC,research,36.0262016952,-78.8970905823,,Storeria dekayi,Dekay's Brownsnake,Reptilia,28562,Animalia,Chordata,Reptilia
7647235,8/25/17,2017-08-25 18:13:44 UTC,research,36.0242509749,-78.9249143936,,Lobelia cardinalis,cardinal flower,Plantae,48038,Plantae,Tracheophyta,Magnoliopsida
7689644,8/28/17,2017-08-28 16:59:03 UTC,research,36.0236583333,-78.92778,,Pisaurina mira,American Nursery Web Spider,Arachnida,84109,Animalia,Arthropoda,Arachnida
7690745,8/25/17,2017-08-25 22:45:26 UTC,research,36.0236278333,-78.92752,,Asimina triloba,common pawpaw,Plantae,50897,Plantae,Tracheophyta,Magnoliopsida
7692365,8/28/17,2017-08-28 21:18:37 UTC,research,36.0228618371,-78.89587529,,Prosapia bicincta,Two-lined Spittlebug,Insecta,126291,Animalia,Arthropoda,Insecta
7774394,7/25/17,2017-07-25 16:52:00 UTC,research,36.0126954444,-78.9286655,,Flavoparmelia caperata,common greenshield lichen,Fungi,117943,Fungi,Ascomycota,Lecanoromycetes
7784520,9/4/17,2017-09-04 18:48:55 UTC,research,36.020094296,-78.8953083689,,Chamaecrista fasciculata,partridge pea,Plantae,127907,Plantae,Tracheophyta,Magnoliopsida
7803103,7/25/17,2017-07-25 16:45:00 UTC,research,36.0128158889,-78.9290573333,,Hedera helix,common ivy,Plantae,55882,Plantae,Tracheophyta,Magnoliopsida
7803114,7/25/17,2017-07-25 16:46:00 UTC,research,36.0128365278,-78.9288486389,,Quercus phellos,willow oak,Plantae,119983,Plantae,Tracheophyta,Magnoliopsida
7804122,9/2/17,2017-09-02 15:48:00 UTC,research,36.0328256543,-78.9614063501,,Diospyros virginiana,American persimmon,Plantae,83435,Plantae,Tracheophyta,Magnoliopsida
7804124,9/2/17,2017-09-02 16:17:00 UTC,research,36.0341830108,-78.962052762,,Mikania scandens,climbing hempvine,Plantae,119145,Plantae,Tracheophyta,Magnoliopsida
7804125,9/2/17,2017-09-02 15:42:00 UTC,research,36.032416314,-78.9612078667,,Asclepias verticillata,whorled milkweed,Plantae,125379,Plantae,Tracheophyta,Magnoliopsida
7804129,9/2/17,2017-09-02 17:22:00 UTC,research,36.0357912996,-78.9679455757,,Oxydendrum arboreum,sourwood,Plantae,133354,Plantae,Tracheophyta,Magnoliopsida
7804130,9/2/17,2017-09-02 17:21:00 UTC,research,36.0357999754,-78.9685034752,,Chimaphila maculata,striped wintergreen,Plantae,82358,Plantae,Tracheophyta,Magnoliopsida
7804131,9/2/17,2017-09-02 16:51:00 UTC,research,36.0339728905,-78.9636647701,,Fagus grandifolia,American beech,Plantae,49202,Plantae,Tracheophyta,Magnoliopsida
7804132,9/2/17,2017-09-02 17:20:00 UTC,research,36.035444264,-78.9675807953,,Quercus alba,white oak,Plantae,54779,Plantae,Tracheophyta,Magnoliopsida
7804134,9/2/17,2017-09-02 17:45:00 UTC,research,36.0350955706,-78.9634341002,,Morella cerifera,wax myrtle,Plantae,119956,Plantae,Tracheophyta,Magnoliopsida
7804135,9/2/17,2017-09-02 17:02:00 UTC,research,36.0344552043,-78.9650917053,,Goodyera pubescens,downy rattlesnake plantain,Plantae,62406,Plantae,Tracheophyta,Liliopsida
7804329,9/2/17,2017-09-02 15:34:00 UTC,research,36.0321213212,-78.9605855942,,Athyrium filix-femina,lady fern,Plantae,52669,Plantae,Tracheophyta,Polypodiopsida
7804330,9/2/17,2017-09-02 15:36:00 UTC,research,36.0321191521,-78.960588276,,Murdannia keisak,marsh dewflower,Plantae,125685,Plantae,Tracheophyta,Liliopsida
7804357,9/2/17,2017-09-02 17:42:00 UTC,research,36.0354145806,-78.964099288,,Rhexia mariana,Maryland meadowbeauty,Plantae,126318,Plantae,Tracheophyta,Magnoliopsida
7813666,9/6/17,2017-09-07 00:23:08 UTC,research,36.0189333333,-78.9326166667,,Didelphis virginiana,Virginia Opossum,Mammalia,42652,Animalia,Chordata,Mammalia
7824707,9/7/17,2017-09-07 20:28:28 UTC,research,36.0223887691,-78.8973121504,,Acharia stimulea,Saddleback Caterpillar Moth,Insecta,122228,Animalia,Arthropoda,Insecta
7928310,9/15/17,2017-09-15 13:30:55 UTC,research,36.0251083333,-78.9295883333,,Anisota virginiensis,Pink-striped Oakworm Moth,Insecta,81584,Animalia,Arthropoda,Insecta
7936798,9/15/17,2017-09-15 22:34:01 UTC,research,35.9891724187,-78.8896587103,,Prosapia bicincta,Two-lined Spittlebug,Insecta,126291,Animalia,Arthropoda,Insecta
7937561,9/15/17,2017-09-15 17:14:19 UTC,research,36.0314650769,-78.8964704315,,Halysidota harrisii,Sycamore Tussock Moth,Insecta,126397,Animalia,Arthropoda,Insecta
7949645,9/16/17,,research,36.0255185,-78.8977037,,Hyphantria cunea,Fall Webworm Moth,Insecta,127133,Animalia,Arthropoda,Insecta
7949687,9/16/17,,research,36.0255185,-78.8977037,,Dichromorpha viridis,Short-winged Green Grasshopper,Insecta,146635,Animalia,Arthropoda,Insecta
7949702,9/16/17,,research,36.0195388889,-78.8954166667,,Chinavia hilaris,Green Stink Bug,Insecta,485010,Animalia,Arthropoda,Insecta
7995956,9/18/17,2017-09-18 15:55:44 UTC,research,36.0136108398,-78.9208297729,,Juniperus virginiana,eastern redcedar,Plantae,49399,Plantae,Tracheophyta,Pinopsida
8107420,9/17/17,2017-09-17 13:38:38 UTC,research,36.0106722167,-78.9036333333,,Labena grallator,,Insecta,299019,Animalia,Arthropoda,Insecta
8144719,9/1/17,,research,36.023002,-78.928995,,Rhus copallinum,shining sumac,Plantae,126698,Plantae,Tracheophyta,Magnoliopsida
8176522,5/16/17,2017-05-16 16:02:06 UTC,research,36.0338528333,-78.911225,,Ambystoma opacum,Marbled Salamander,Amphibia,26736,Animalia,Chordata,Amphibia
8216086,9/29/17,2017-09-30 02:32:37 UTC,research,36.0242471667,-78.8901833333,,Apantesis vittata,Banded Tiger Moth,Insecta,196741,Animalia,Arthropoda,Insecta
8231093,10/2/17,2017-10-03 02:35:25 UTC,research,36.0247799514,-78.9294286979,,Atteva aurea,Ailanthus Webworm Moth,Insecta,116681,Animalia,Arthropoda,Insecta
8388806,10/13/17,2017-10-13 19:48:59 UTC,research,35.98533493,-78.8728781138,,Polistes,Umbrella Paper Wasps,Insecta,52756,Animalia,Arthropoda,Insecta
8397363,10/13/17,2017-10-13 15:12:39 UTC,research,36.006803304,-78.8534852688,,Lapara coniferarum,Southern Pine Sphinx,Insecta,143442,Animalia,Arthropoda,Insecta
8412301,10/13/17,2017-10-13 15:12:11 UTC,research,36.0052833333,-78.852225,,Halysidota tessellaris,Banded Tussock Moth,Insecta,120217,Animalia,Arthropoda,Insecta
8412407,9/22/17,2017-09-22 18:55:51 UTC,research,36.0058138833,-78.8529366667,,Limenitis arthemis,Red-spotted Admiral,Insecta,60607,Animalia,Arthropoda,Insecta
8412473,8/24/17,2017-08-24 15:52:28 UTC,research,36.0063621159,-78.8535853842,,Acharia stimulea,Saddleback Caterpillar Moth,Insecta,122228,Animalia,Arthropoda,Insecta
8412528,8/18/17,2017-08-18 19:04:15 UTC,research,36.0050861167,-78.8517383333,,Coluber constrictor,North American Racer,Reptilia,27137,Animalia,Chordata,Reptilia
8490043,10/21/17,2017-10-21 14:43:57 UTC,research,36.0262583569,-78.8971047477,,Didelphis virginiana,Virginia Opossum,Mammalia,42652,Animalia,Chordata,Mammalia
8491837,10/21/17,2017-10-21 16:53:22 UTC,research,36.00634445,-78.85208,,Sceloporus undulatus,Eastern Fence Lizard,Reptilia,36142,Animalia,Chordata,Reptilia
8601899,10/29/17,2017-10-29 16:30:57 UTC,research,36.0313873291,-78.935836792,,Euphorbia maculata,Spotted spurge,Plantae,58893,Plantae,Tracheophyta,Magnoliopsida
8621734,10/21/17,2017-10-21 18:52:10 UTC,research,36.0058361167,-78.8524866667,,Pyrrharctia isabella,Isabella Tiger Moth,Insecta,59675,Animalia,Arthropoda,Insecta
8655507,9/18/17,2017-09-18 15:57:03 UTC,research,36.0133323669,-78.9208297729,,Solanum carolinense,Carolina horsenettle,Plantae,52899,Plantae,Tracheophyta,Magnoliopsida
8695199,11/5/17,2017-11-05 17:26:47 UTC,research,36.024425,-78.8998033333,,Asimina triloba,common pawpaw,Plantae,50897,Plantae,Tracheophyta,Magnoliopsida
8711185,8/21/16,,research,36.05471,-78.838748,,Rhus copallinum,shining sumac,Plantae,126698,Plantae,Tracheophyta,Magnoliopsida
8711186,8/21/16,,research,36.05471,-78.838748,,Vitis rotundifolia,muscadine,Plantae,82529,Plantae,Tracheophyta,Magnoliopsida
8711187,8/21/16,,research,36.05471,-78.838748,,Passiflora incarnata,purple passionflower,Plantae,51453,Plantae,Tracheophyta,Magnoliopsida
8711188,8/21/16,,research,36.05471,-78.838748,,Pontederia cordata,pickerelweed,Plantae,52599,Plantae,Tracheophyta,Liliopsida
8711191,8/21/16,,research,36.05471,-78.838748,,Prunella vulgaris,common selfheal,Plantae,52764,Plantae,Tracheophyta,Magnoliopsida
8711192,8/21/16,,research,36.05471,-78.838748,,Chimaphila maculata,striped wintergreen,Plantae,82358,Plantae,Tracheophyta,Magnoliopsida
8711194,8/21/16,,research,36.05471,-78.838748,,Mitchella repens,partridgeberry,Plantae,83799,Plantae,Tracheophyta,Magnoliopsida
8711195,8/21/16,,research,36.05471,-78.838748,,Euonymus americanus,strawberry bush,Plantae,83150,Plantae,Tracheophyta,Magnoliopsida
8711196,8/21/16,,research,36.05471,-78.838748,,Micrathena gracilis,Spined Micrathena,Arachnida,85333,Animalia,Arthropoda,Arachnida
8711236,8/21/16,,research,36.055325,-78.838529,,Ulmus alata,Winged Elm,Plantae,84292,Plantae,Tracheophyta,Magnoliopsida
8711239,8/21/16,,research,36.055325,-78.838529,,Ostrya virginiana,American hophornbeam,Plantae,54771,Plantae,Tracheophyta,Magnoliopsida
8725785,9/2/17,,research,36.033892,-78.962168,,Erythemis simplicicollis,Eastern Pondhawk,Insecta,61495,Animalia,Arthropoda,Insecta
8725919,9/2/17,,research,36.035283,-78.966312,,Odocoileus virginianus,White-tailed Deer,Mammalia,42223,Animalia,Chordata,Mammalia
8731238,11/8/17,2017-11-08 13:34:58 UTC,research,36.0158348083,-78.9186096191,,Phytolacca americana,American pokeweed,Plantae,48599,Plantae,Tracheophyta,Magnoliopsida
8731247,11/8/17,2017-11-08 13:31:53 UTC,research,36.0158348083,-78.9186096191,,Ambrosia artemisiifolia,common ragweed,Plantae,53587,Plantae,Tracheophyta,Magnoliopsida
8731253,11/8/17,2017-11-08 13:32:25 UTC,research,36.0158348083,-78.9186096191,,Rumex obtusifolius,broad-leaved dock,Plantae,63371,Plantae,Tracheophyta,Magnoliopsida
8731282,11/8/17,2017-11-08 13:36:40 UTC,research,36.0158348083,-78.9186096191,,Ipomoea purpurea,common morning-glory,Plantae,52344,Plantae,Tracheophyta,Magnoliopsida
8731298,11/8/17,2017-11-08 13:37:52 UTC,research,36.0158348083,-78.9186096191,,Ipomoea purpurea,common morning-glory,Plantae,52344,Plantae,Tracheophyta,Magnoliopsida
8734246,11/8/17,2017-11-08 13:33:42 UTC,research,36.0158348083,-78.9186096191,,Oenothera biennis,common evening-primrose,Plantae,62207,Plantae,Tracheophyta,Magnoliopsida
8734373,11/8/17,2017-11-08 13:38:29 UTC,research,36.0158348083,-78.9186096191,,Ipomoea purpurea,common morning-glory,Plantae,52344,Plantae,Tracheophyta,Magnoliopsida
8734436,11/8/17,2017-11-08 13:37:19 UTC,research,36.0158348083,-78.9186096191,,Ligustrum lucidum,tree privet,Plantae,77740,Plantae,Tracheophyta,Magnoliopsida
8736510,11/8/17,2017-11-08 13:32:16 UTC,research,36.0158348083,-78.9186096191,,Microstegium vimineum,Japanese stiltgrass,Plantae,116710,Plantae,Tracheophyta,Liliopsida
8736908,9/19/17,2017-09-19 21:26:05 UTC,research,36.0278305,-78.9055616667,,Ampelopsis glandulosa brevipedunculata,porcelain berry,Plantae,457553,Plantae,Tracheophyta,Magnoliopsida
8806095,11/14/17,2017-11-14 18:58:16 UTC,research,36.0077927728,-78.9155133349,,Juniperus virginiana,eastern redcedar,Plantae,49399,Plantae,Tracheophyta,Pinopsida
8881442,11/20/17,2017-11-20 18:12:24 UTC,research,36.0105552673,-78.9225006104,,Phytolacca americana,American pokeweed,Plantae,48599,Plantae,Tracheophyta,Magnoliopsida
8881463,11/20/17,2017-11-20 18:11:07 UTC,research,36.0102767944,-78.9222259521,,Plantago lanceolata,ribwort plantain,Plantae,53178,Plantae,Tracheophyta,Magnoliopsida
8881467,11/20/17,2017-11-20 18:10:11 UTC,research,36.0102767944,-78.9222259521,,Trifolium repens,white clover,Plantae,55745,Plantae,Tracheophyta,Magnoliopsida
8918389,11/24/17,2017-11-24 15:48:51 UTC,research,36.0106361167,-78.9036033333,,Araneus marmoreus,Marbled Orbweaver,Arachnida,120183,Animalia,Arthropoda,Arachnida
8920981,11/24/17,2017-11-24 16:51:00 UTC,research,36.0152199909,-78.9188261563,,Colaptes auratus,Northern Flicker,Aves,18236,Animalia,Chordata,Aves
8921041,11/24/17,2017-11-24 16:26:00 UTC,research,36.0552959665,-78.8414147968,,Pleopeltis michauxiana,resurrection fern,Plantae,698726,Plantae,Tracheophyta,Polypodiopsida
9013031,11/26/17,2017-11-26 22:00:02 UTC,research,36.007393044,-78.9234299576,,Xylocopa virginica,Eastern Carpenter Bee,Insecta,51110,Animalia,Arthropoda,Insecta
9020826,12/2/17,2017-12-02 18:40:00 UTC,research,36.0195645326,-78.8837183453,,Rosa palustris,swamp rose,Plantae,82302,Plantae,Tracheophyta,Magnoliopsida
9020827,12/2/17,2017-12-02 18:42:00 UTC,research,36.0195645326,-78.8837183453,,Cephalanthus occidentalis,buttonbush,Plantae,52763,Plantae,Tracheophyta,Magnoliopsida
9020828,12/2/17,2017-12-02 19:07:00 UTC,research,36.0195645326,-78.8837183453,,Diospyros virginiana,American persimmon,Plantae,83435,Plantae,Tracheophyta,Magnoliopsida
9020829,12/2/17,2017-12-02 19:12:00 UTC,research,36.0195645326,-78.8837183453,,Hericium erinaceus,lion's-mane mushroom,Fungi,49158,Fungi,Basidiomycota,Agaricomycetes
9020831,12/2/17,2017-12-02 19:24:00 UTC,research,36.0195645326,-78.8837183453,,Ilex decidua,possumhaw,Plantae,120006,Plantae,Tracheophyta,Magnoliopsida
9020832,12/2/17,2017-12-02 19:27:00 UTC,research,36.0195645326,-78.8837183453,,Acris crepitans,Northern Cricket Frog,Amphibia,24230,Animalia,Chordata,Amphibia
9020833,12/2/17,2017-12-02 19:43:00 UTC,research,36.0195645326,-78.8837183453,,Bignonia capreolata,cross vine,Plantae,67823,Plantae,Tracheophyta,Magnoliopsida
9020835,12/2/17,2017-12-02 19:57:00 UTC,research,36.0195645326,-78.8837183453,,Iris pseudacorus,Yellow Iris,Plantae,47779,Plantae,Tracheophyta,Liliopsida
9020836,12/2/17,2017-12-02 19:58:00 UTC,research,36.0195645326,-78.8837183453,,Dulichium arundinaceum,Three-way Sedge,Plantae,76745,Plantae,Tracheophyta,Liliopsida
9020837,12/2/17,2017-12-02 20:15:00 UTC,research,36.0195645326,-78.8837183453,,Elaeagnus umbellata,autumn olive,Plantae,64697,Plantae,Tracheophyta,Magnoliopsida
9020838,12/2/17,2017-12-02 20:22:00 UTC,research,36.0195645326,-78.8837183453,,Carya ovata,shagbark hickory,Plantae,54791,Plantae,Tracheophyta,Magnoliopsida
9020839,12/2/17,2017-12-02 20:25:00 UTC,research,36.0195645326,-78.8837183453,,Smilax glauca,sawbrier,Plantae,81831,Plantae,Tracheophyta,Liliopsida
9043873,12/4/17,2017-12-04 16:32:04 UTC,research,36.0116653442,-78.9247207642,,Platanus occidentalis,American sycamore,Plantae,49662,Plantae,Tracheophyta,Magnoliopsida
9043901,12/4/17,2017-12-04 16:30:22 UTC,research,36.0116653442,-78.9247207642,,Geranium carolinianum,Carolina crane's-bill,Plantae,58917,Plantae,Tracheophyta,Magnoliopsida
9043954,12/4/17,2017-12-04 16:27:56 UTC,research,36.0116653442,-78.9247207642,,Aculus tetanothrix,Willow Bead Gall Mite,Arachnida,469076,Animalia,Arthropoda,Arachnida
9046118,12/4/17,2017-12-04 16:19:59 UTC,research,36.011390686,-78.9247207642,,Plantago lanceolata,ribwort plantain,Plantae,53178,Plantae,Tracheophyta,Magnoliopsida
9051710,12/4/17,2017-12-04 16:21:02 UTC,research,36.0116653442,-78.9247207642,,Glechoma hederacea,ground-ivy,Plantae,55830,Plantae,Tracheophyta,Magnoliopsida
9051713,12/4/17,2017-12-04 16:17:19 UTC,research,36.0116653442,-78.9247207642,,Ligustrum lucidum,tree privet,Plantae,77740,Plantae,Tracheophyta,Magnoliopsida
9051732,12/4/17,2017-12-04 16:15:58 UTC,research,36.0227775574,-78.9441680908,,Artemisia vulgaris,common mugwort,Plantae,52856,Plantae,Tracheophyta,Magnoliopsida
9067095,12/6/17,2017-12-06 20:24:41 UTC,research,36.01589329,-78.89718683,,Alliaria petiolata,garlic mustard,Plantae,56061,Plantae,Tracheophyta,Magnoliopsida
9067322,12/6/17,2017-12-06 20:47:09 UTC,research,36.02196738,-78.87068886,,Alliaria petiolata,garlic mustard,Plantae,56061,Plantae,Tracheophyta,Magnoliopsida
9067544,12/6/17,2017-12-06 21:03:29 UTC,research,36.02108253,-78.87172559,,Alliaria petiolata,garlic mustard,Plantae,56061,Plantae,Tracheophyta,Magnoliopsida
9067869,12/6/17,2017-12-06 21:27:09 UTC,research,36.02208639,-78.87075685,,Alliaria petiolata,garlic mustard,Plantae,56061,Plantae,Tracheophyta,Magnoliopsida
9078416,12/7/17,2017-12-07 18:24:09 UTC,research,36.05486737,-78.84998667,,Alliaria petiolata,garlic mustard,Plantae,56061,Plantae,Tracheophyta,Magnoliopsida
9078740,12/7/17,2017-12-07 18:43:00 UTC,research,36.05473905,-78.85024906,,Alliaria petiolata,garlic mustard,Plantae,56061,Plantae,Tracheophyta,Magnoliopsida
9079044,12/7/17,2017-12-07 19:12:10 UTC,research,36.0532185,-78.85367645,,Alliaria petiolata,garlic mustard,Plantae,56061,Plantae,Tracheophyta,Magnoliopsida
9079330,12/7/17,2017-12-07 19:35:51 UTC,research,36.05498124,-78.8511336,,Alliaria petiolata,garlic mustard,Plantae,56061,Plantae,Tracheophyta,Magnoliopsida
9112798,12/10/17,2017-12-10 17:20:00 UTC,research,36.0304821823,-78.9008194024,,Thryothorus ludovicianus,Carolina Wren,Aves,7513,Animalia,Chordata,Aves
9112799,12/10/17,2017-12-10 17:21:00 UTC,research,36.0304821823,-78.9008194024,,Setophaga pinus,Pine Warbler,Aves,145244,Animalia,Chordata,Aves
9112800,12/10/17,2017-12-10 17:25:00 UTC,research,36.0304821823,-78.9008194024,,Poecile carolinensis,Carolina Chickadee,Aves,144814,Animalia,Chordata,Aves
9112801,12/10/17,2017-12-10 17:26:00 UTC,research,36.0304821823,-78.9008194024,,Thryothorus ludovicianus,Carolina Wren,Aves,7513,Animalia,Chordata,Aves
9112802,12/10/17,2017-12-10 17:42:00 UTC,research,36.0304821823,-78.9008194024,,Regulus calendula,Ruby-crowned Kinglet,Aves,117095,Animalia,Chordata,Aves
9112803,12/10/17,2017-12-10 17:58:00 UTC,research,36.0304821823,-78.9008194024,,Setophaga coronata,Yellow-rumped Warbler,Aves,145245,Animalia,Chordata,Aves
9113660,12/10/17,2017-12-10 18:56:02 UTC,research,36.05529905,-78.84228298,,Alliaria petiolata,garlic mustard,Plantae,56061,Plantae,Tracheophyta,Magnoliopsida
9114234,12/10/17,2017-12-10 20:37:52 UTC,research,36.02115351,-78.87110798,,Alliaria petiolata,garlic mustard,Plantae,56061,Plantae,Tracheophyta,Magnoliopsida
9124484,12/11/17,2017-12-11 17:20:14 UTC,research,36.0178856,-78.89701104,,Alliaria petiolata,garlic mustard,Plantae,56061,Plantae,Tracheophyta,Magnoliopsida
9125359,12/11/17,2017-12-11 17:50:56 UTC,research,36.01772477,-78.89660428,,Alliaria petiolata,garlic mustard,Plantae,56061,Plantae,Tracheophyta,Magnoliopsida
9125449,12/11/17,2017-12-11 19:09:20 UTC,research,36.01607078,-78.89278639,,Alliaria petiolata,garlic mustard,Plantae,56061,Plantae,Tracheophyta,Magnoliopsida
9144023,12/13/17,2017-12-13 14:24:14 UTC,research,36.01567525,-78.88673419,,Alliaria petiolata,garlic mustard,Plantae,56061,Plantae,Tracheophyta,Magnoliopsida
9155525,12/14/17,2017-12-14 17:08:57 UTC,research,35.9972229004,-78.9061126709,,Senecio vulgaris,common groundsel,Plantae,53211,Plantae,Tracheophyta,Magnoliopsida
9163906,12/15/17,2017-12-15 17:14:28 UTC,research,36.0551757813,-78.8111877441,,Diphasiastrum digitatum,fan clubmoss,Plantae,122100,Plantae,Tracheophyta,Lycopodiopsida
9296999,12/29/17,2017-12-29 17:52:41 UTC,research,36,-78.9008331299,,Ilex cornuta,Chinese holly,Plantae,164038,Plantae,Tracheophyta,Magnoliopsida
9297033,12/29/17,2017-12-29 17:47:04 UTC,research,36,-78.9013900757,,Senecio vulgaris,common groundsel,Plantae,53211,Plantae,Tracheophyta,Magnoliopsida
9297046,12/29/17,2017-12-29 17:44:02 UTC,research,36,-78.9005584717,,Betula nigra,river birch,Plantae,117429,Plantae,Tracheophyta,Magnoliopsida
9297066,12/29/17,2017-12-29 17:41:23 UTC,research,36,-78.9011077881,,Chasmanthium latifolium,inland wood oats,Plantae,84364,Plantae,Tracheophyta,Liliopsida
9304225,12/29/17,2017-12-29 17:52:12 UTC,research,36,-78.9013900757,,Hedera helix,common ivy,Plantae,55882,Plantae,Tracheophyta,Magnoliopsida
9319139,12/29/17,2017-12-29 17:39:40 UTC,research,36,-78.9008331299,,Morella cerifera,wax myrtle,Plantae,119956,Plantae,Tracheophyta,Magnoliopsida
9345152,1/2/18,2018-01-02 16:54:45 UTC,research,36.0272216797,-78.8419418335,,Larus delawarensis,Ring-billed Gull,Aves,4364,Animalia,Chordata,Aves
9371964,1/5/18,2018-01-05 14:04:53 UTC,research,36.0250971667,-78.9295716667,,Regulus calendula,Ruby-crowned Kinglet,Aves,117095,Animalia,Chordata,Aves
9449664,1/12/18,2018-01-12 15:31:51 UTC,research,36.0427780151,-78.9038925171,,Ulmus alata,Winged Elm,Plantae,84292,Plantae,Tracheophyta,Magnoliopsida
9449808,1/12/18,2018-01-12 15:26:24 UTC,research,36.043056488,-78.9041671753,,Verbena brasiliensis,Brazilian Vervain,Plantae,128698,Plantae,Tracheophyta,Magnoliopsida
9460941,1/13/18,2018-01-13 20:43:26 UTC,research,36.0251583333,-78.92952,,Toxostoma rufum,Brown Thrasher,Aves,14898,Animalia,Chordata,Aves
9462107,1/13/18,2018-01-13 22:11:45 UTC,research,36.0249778333,-78.929445,,Thryothorus ludovicianus,Carolina Wren,Aves,7513,Animalia,Chordata,Aves
9469999,1/14/18,2018-01-14 15:20:52 UTC,research,36.0269138333,-78.9288866667,,Regulus calendula,Ruby-crowned Kinglet,Aves,117095,Animalia,Chordata,Aves
9470632,1/14/18,2018-01-14 16:22:37 UTC,research,36.0243966225,-78.9292470465,,Vulpes vulpes,Red Fox,Mammalia,42069,Animalia,Chordata,Mammalia
9602637,1/24/18,2018-01-24 18:02:06 UTC,research,36.0214120562,-78.8962333113,,Ardea herodias,Great Blue Heron,Aves,4956,Animalia,Chordata,Aves
9634463,1/27/18,2018-01-27 21:34:35 UTC,research,36.01204033,-78.91713098,,Turdus migratorius,American Robin,Aves,12727,Animalia,Chordata,Aves
9716515,2/3/18,2018-02-03 15:12:24 UTC,research,36.022319571,-78.8965959384,,Buteo lineatus,Red-shouldered Hawk,Aves,5206,Animalia,Chordata,Aves
9858904,2/14/18,2018-02-14 17:53:19 UTC,research,36.0058287671,-78.9132399113,,Ilex opaca,American holly,Plantae,60749,Plantae,Tracheophyta,Magnoliopsida
9907164,2/17/18,2018-02-18 01:01:10 UTC,research,36.0105552673,-78.9211120605,,Lamium amplexicaule,henbit deadnettle,Plantae,55459,Plantae,Tracheophyta,Magnoliopsida
9912150,2/18/18,2018-02-18 22:41:31 UTC,research,36.0118811,-78.9172737,,Cardinalis cardinalis,Northern Cardinal,Aves,9083,Animalia,Chordata,Aves
9974290,2/23/18,2018-02-23 18:23:47 UTC,research,36.011390686,-78.9247207642,,Clematis terniflora,autumn clematis,Plantae,62776,Plantae,Tracheophyta,Magnoliopsida
9974302,2/23/18,2018-02-23 18:18:40 UTC,research,36.0116653442,-78.924446106,,Cardamine hirsuta,hairy bittercress,Plantae,55829,Plantae,Tracheophyta,Magnoliopsida
9974304,2/23/18,2018-02-23 18:18:05 UTC,research,36.0116653442,-78.924446106,,Plantago lanceolata,ribwort plantain,Plantae,53178,Plantae,Tracheophyta,Magnoliopsida
9974305,2/23/18,2018-02-23 18:18:00 UTC,research,36.0116653442,-78.924446106,,Trifolium repens,white clover,Plantae,55745,Plantae,Tracheophyta,Magnoliopsida
9974308,2/23/18,2018-02-23 18:17:54 UTC,research,36.0116653442,-78.924446106,,Veronica persica,bird's-eye speedwell,Plantae,55666,Plantae,Tracheophyta,Magnoliopsida
10020821,2/27/18,2018-02-27 17:11:02 UTC,research,36.0261280183,-78.8971724734,,Storeria dekayi,Dekay's Brownsnake,Reptilia,28562,Animalia,Chordata,Reptilia
10056044,3/2/18,2018-03-02 18:38:59 UTC,research,36.0195320053,-78.8835919463,,Magnolia grandiflora,southern magnolia,Plantae,83074,Plantae,Tracheophyta,Magnoliopsida
10359959,3/22/18,2018-03-22 17:46:48 UTC,research,36.0328104487,-78.8958705124,,Rhus glabra,smooth sumac,Plantae,54764,Plantae,Tracheophyta,Magnoliopsida
10489959,3/29/18,2018-03-29 15:12:01 UTC,research,36.0305471667,-78.8987416667,,Hyla chrysoscelis,Cope's Gray Treefrog,Amphibia,23930,Animalia,Chordata,Amphibia
10508243,3/30/18,2018-03-30 15:57:56 UTC,research,36.0329487978,-78.9249669102,,Ribes aureum,golden currant,Plantae,55544,Plantae,Tracheophyta,Magnoliopsida
10510706,3/30/18,2018-03-30 17:59:23 UTC,research,36.0306823579,-78.897701212,,Marmota monax,Groundhog,Mammalia,46095,Animalia,Chordata,Mammalia
10520179,3/29/18,2018-03-29 17:41:35 UTC,research,36.0311805,-78.8976216667,,Harmonia axyridis,Asian Lady Beetle,Insecta,48484,Animalia,Arthropoda,Insecta
10548549,4/1/18,2018-04-01 16:44:54 UTC,research,35.98927231,-78.8772228,,Viola sororia priceana,Confederate violet,Plantae,348951,Plantae,Tracheophyta,Magnoliopsida
10560901,4/1/18,2018-04-01 14:55:11 UTC,research,36.0313873291,-78.9361114502,,Senecio vulgaris,common groundsel,Plantae,53211,Plantae,Tracheophyta,Magnoliopsida
10628190,4/1/18,2018-04-01 19:37:41 UTC,research,36.01079445,-78.9035116667,,Melanerpes carolinus,Red-bellied Woodpecker,Aves,18205,Animalia,Chordata,Aves
10628226,3/3/18,2018-03-03 21:47:08 UTC,research,36.0109361167,-78.903655,,Sialia sialis,Eastern Bluebird,Aves,12942,Animalia,Chordata,Aves
10679700,4/6/18,2018-04-06 16:01:02 UTC,research,36.0035820007,-78.9006652832,,Gelsemium sempervirens,yellow jessamine,Plantae,83070,Plantae,Tracheophyta,Magnoliopsida
10708526,4/1/18,2018-04-01 20:53:59 UTC,research,36.0196679598,-78.8951821905,,Viola sororia,common blue violet,Plantae,82816,Plantae,Tracheophyta,Magnoliopsida
10708552,4/1/18,2018-04-01 20:55:48 UTC,research,36.0199816106,-78.8947814517,,Andricus quercusstrobilanus,lobed oak gall wasp,Insecta,473388,Animalia,Arthropoda,Insecta
10775834,4/11/18,2018-04-11 15:38:13 UTC,research,35.9849666667,-78.8838583333,,Elaeagnus pungens,thorny olive,Plantae,162214,Plantae,Tracheophyta,Magnoliopsida
10779938,4/11/18,2018-04-11 19:09:32 UTC,research,36.0230729822,-78.8967207727,,Veronica persica,bird's-eye speedwell,Plantae,55666,Plantae,Tracheophyta,Magnoliopsida
10833669,4/12/18,2018-04-12 22:06:44 UTC,research,36.0313873291,-78.935836792,,Lamium amplexicaule,henbit deadnettle,Plantae,55459,Plantae,Tracheophyta,Magnoliopsida
10833677,4/12/18,2018-04-12 21:58:50 UTC,research,36.031665802,-78.9363861084,,Vespula maculifrons,Eastern Yellowjacket,Insecta,119994,Animalia,Arthropoda,Insecta
10857414,4/13/18,2018-04-13 15:23:33 UTC,research,35.9839283551,-78.8730661964,,Allium vineale,wild garlic,Plantae,75371,Plantae,Tracheophyta,Liliopsida
10861069,4/12/18,2018-04-12 12:42:02 UTC,research,36.0318666667,-78.8891616667,,Malacosoma americana,Eastern Tent Caterpillar Moth,Insecta,211100,Animalia,Arthropoda,Insecta
10876513,4/13/18,2018-04-13 23:36:28 UTC,research,36.0286589247,-78.8917375847,,Ornithogalum umbellatum,common star-of-Bethlehem,Plantae,56137,Plantae,Tracheophyta,Liliopsida
10876662,4/13/18,2018-04-13 23:39:42 UTC,research,36.0287218632,-78.891822386,,Galium aparine,catchweed bedstraw,Plantae,53059,Plantae,Tracheophyta,Magnoliopsida
10909086,4/14/18,2018-04-14 16:16:09 UTC,research,36.0261467938,-78.8971046638,,Hyla chrysoscelis,Cope's Gray Treefrog,Amphibia,23930,Animalia,Chordata,Amphibia
10916993,4/14/18,2018-04-14 19:16:08 UTC,research,36.0088657402,-78.8959603664,,Ornithogalum umbellatum,common star-of-Bethlehem,Plantae,56137,Plantae,Tracheophyta,Liliopsida
10935006,4/14/18,2018-04-14 22:27:44 UTC,research,36.0193755571,-78.8989196812,,Vinca major,greater periwinkle,Plantae,53326,Plantae,Tracheophyta,Magnoliopsida
10986783,4/15/18,2018-04-15 21:46:12 UTC,research,36.0223916667,-78.9304116667,,Lunaria annua,Annual Honesty,Plantae,55886,Plantae,Tracheophyta,Magnoliopsida
10987422,6/6/17,2017-06-06 18:04:49 UTC,research,36.01123055,-78.9150783333,,Amanita flavoconia,Yellow Patches,Fungi,125389,Fungi,Basidiomycota,Agaricomycetes
11115131,4/18/18,2018-04-18 13:38:44 UTC,research,36.00695601,-78.91344587,,Sciurus carolinensis,Eastern Gray Squirrel,Mammalia,46017,Animalia,Chordata,Mammalia
11117807,4/16/18,2018-04-16 20:23:51 UTC,research,36.0213666667,-78.8961416667,,Hyla chrysoscelis,Cope's Gray Treefrog,Amphibia,23930,Animalia,Chordata,Amphibia
11118260,4/14/18,2018-04-14 17:43:47 UTC,research,36.0190055,-78.89608,,Antheraea polyphemus,Polyphemus Moth,Insecta,47919,Animalia,Arthropoda,Insecta
11123206,4/18/18,2018-04-18 17:09:22 UTC,research,35.9846833333,-78.8841383333,,Cerastium glomeratum,Sticky mouse-ear chickweed,Plantae,52973,Plantae,Tracheophyta,Magnoliopsida
11123317,4/18/18,2018-04-18 17:13:13 UTC,research,35.9847,-78.884195,,Rumex crispus,curled dock,Plantae,53197,Plantae,Tracheophyta,Magnoliopsida
11320527,4/22/18,2018-04-22 15:34:10 UTC,research,36.0320663033,-78.894920759,,Veronica persica,bird's-eye speedwell,Plantae,55666,Plantae,Tracheophyta,Magnoliopsida
11330675,4/22/18,2018-04-22 19:20:47 UTC,research,36.003294373,-78.8958736137,,Packera anonyma,Small's ragwort,Plantae,67825,Plantae,Tracheophyta,Magnoliopsida
11341577,4/22/18,2018-04-22 23:14:28 UTC,research,36.0146857566,-78.9157195297,,Vinca major,greater periwinkle,Plantae,53326,Plantae,Tracheophyta,Magnoliopsida
11341647,4/22/18,2018-04-22 23:15:31 UTC,research,36.0146963597,-78.9155463596,,Nandina domestica,Heavenly bamboo,Plantae,127010,Plantae,Tracheophyta,Magnoliopsida
11347442,4/22/18,2018-04-22 19:53:37 UTC,research,36.0148416667,-78.914795,,Ornithogalum umbellatum,common star-of-Bethlehem,Plantae,56137,Plantae,Tracheophyta,Liliopsida
11369220,4/23/18,2018-04-23 18:53:18 UTC,research,35.9848413617,-78.8838383742,,Toxicodendron radicans,poison ivy,Plantae,58732,Plantae,Tracheophyta,Magnoliopsida
11464002,4/26/18,2018-04-26 16:14:00 UTC,research,36.0151452446,-78.9186330372,,Setophaga coronata,Yellow-rumped Warbler,Aves,145245,Animalia,Chordata,Aves
11464003,4/26/18,2018-04-26 13:49:00 UTC,research,36.0151452446,-78.9186330372,,Buteo lineatus,Red-shouldered Hawk,Aves,5206,Animalia,Chordata,Aves
11464004,4/26/18,2018-04-26 16:06:00 UTC,research,36.0147482854,-78.9184744097,,Dumetella carolinensis,Gray Catbird,Aves,14995,Animalia,Chordata,Aves
11464005,4/26/18,2018-04-26 18:32:00 UTC,research,36.0241276293,-78.9247717336,,Galium aparine,catchweed bedstraw,Plantae,53059,Plantae,Tracheophyta,Magnoliopsida
11464006,4/26/18,2018-04-26 18:35:00 UTC,research,36.0241276293,-78.9247717336,,Ornithogalum umbellatum,common star-of-Bethlehem,Plantae,56137,Plantae,Tracheophyta,Liliopsida
